600401234084888576,2015-05-18 20:43:03,"Kripos_NCIS","Kripos bør fortsette sitt arbeid med voldtektssaker. Evaluering klar, 5 år etter at Voldtektsgruppa ble etablert: https://t.co/pHO1u8bQjR"
601040074638270464,2015-05-20 15:01:35,"Kripos_NCIS",.@BorgeEivind deltar på #dax18 i dag for å snakke om arbeidsmarkedskriminalitet. Med bakgrunn i bl.a denne rapporten https://t.co/8Ir6evgnY3
601450971684679681,2015-05-21 18:14:20,"Kripos_NCIS",På #dagsrevyen fortalte Tone Davik fra Kripos om en ny avhørsutdanning ved @Politihogskolen. Se mer her http://t.co/KqAvNTQXPF
601699852901294080,2015-05-22 10:43:18,"Kripos_NCIS","Denne uka avholdt Interpol regionkonferanse i Romania, også Kripos deltok: http://t.co/xwhNYD0jLa https://t.co/p7DgpjFiUE"
602897904362254337,2015-05-25 18:03:56,"Kripos_NCIS",Operasjon Litas har vært en av de største satsingene mot organisert krim de siste to åra: http://t.co/1lOEkFf3xD
603970715444969473,2015-05-28 17:06:54,"Kripos_NCIS",Vi har fortsatt et håp om at denne personen vil bli identifisert: http://t.co/q0yNWXPVIH #ID-arbeid #Salten
605342480670826497,2015-06-01 11:57:48,"Kripos_NCIS",To saker med til nå uidentifiserte lik oppklart den siste uken: https://t.co/wTACfxVORJ
605343153776914432,2015-06-01 12:00:29,"Kripos_NCIS",Mannen som ble funnet død ved Rønvikfjellet i Salten var fransk statsborger.https://t.co/wTACfxVORJ http://t.co/BFtbaXrjFW
606054777139679232,2015-06-03 11:08:13,"Kripos_NCIS",Møt kollega Ylvis. Kripos har doblet antall supersnuter:  http://t.co/tKU8iJAD36
606574729433120769,2015-06-04 21:34:19,"Kripos_NCIS",Mobilt bokmerke mot overgrep lansert http://t.co/Bi4PiH7vVo
608230708507758592,2015-06-09 11:14:35,"Kripos_NCIS","Fire menn pågrepet for narkotikasalg via ""det mørke nettet"". Omfattende beslag i saken. https://t.co/IghjR9M47h"
608257339611824128,2015-06-09 13:00:25,"Kripos_NCIS",Pressekonferanse om aksjon mot narkotikasalg på det mørke nettet. http://t.co/DVSsk1x2w9
608266701805875201,2015-06-09 13:37:37,"Kripos_NCIS","Utvidet sak om aksjon mot narkotikasalg via ""det mørke nettet"": https://t.co/Riq4ACIzai"
608267713753018368,2015-06-09 13:41:38,"Kripos_NCIS",.@Jonasfabchrist Nå skal den fungere.
608268177173278720,2015-06-09 13:43:29,"Kripos_NCIS",.@Jonasfabchrist her er en lenke som skal fungere: https://t.co/Riq4ACIzai
608268542375526400,2015-06-09 13:44:56,"Kripos_NCIS",. @Jonasfabchrist beklager. Vi har litt problemer med publisering på politi.no.
608349902847000579,2015-06-09 19:08:14,"Kripos_NCIS",Det blir fengslingsmøter i denne saken onsdag ettermiddag http://t.co/uQinluROLj
608744624216256513,2015-06-10 21:16:42,"Kripos_NCIS",Flere med tilknytning til Hells Angels dømt for omfattende narkotikakriminalitet: http://t.co/OwHzCE6SJL
608938330353491968,2015-06-11 10:06:26,"Kripos_NCIS",Styrkesjef Tore Barstad og Siem pilot legger snart til på Sicilia. Skal bidra i OP Triton: https://t.co/KA67gyMjbC http://t.co/kbqfUSQ3zu
608938829031059456,2015-06-11 10:08:25,"Kripos_NCIS",Det har vært gjennomført mange øvelser på transport-etappen fra Norge. Kripos har det operative ansvaret. #OPTriton http://t.co/uEa1aOMYC7
609063245618524160,2015-06-11 18:22:48,"Kripos_NCIS",Skipet Siem Pilot ligger nå i havna i Catania. Reiser etter planen ut i operasjonsområdene før helga. #OPTriton http://t.co/ldjCqBqcAm
609617284643033088,2015-06-13 07:04:21,"Kripos_NCIS",Seksuelle overgrep mot barn skjer oftere enn vi liker å tenke på. Bare noen av dem filmes eller tas bilder av: http://t.co/El7YjbW6R9
609727500382535681,2015-06-13 14:22:18,"Kripos_NCIS",Første dag på patrulje for skipet Siem Pilot utenfor Sicilia. Rolig i våre områder så langt. #OPTriton
610353815469096960,2015-06-15 07:51:04,"Kripos_NCIS",To menn tiltalt for å spre hackede Snapchat-bilder http://t.co/tKSVfg7Lej
610380753688510465,2015-06-15 09:38:06,"Kripos_NCIS",Rolig første helg på patrulje. Brukt tid på å øve og bli kjent. Se mer på: https://t.co/ujkqZ3WVIO #OPTriton http://t.co/pOCEQ0fN69
611587427405299712,2015-06-18 17:33:00,"Kripos_NCIS",RT @idrett: IOC og INTERPOL støtter Norges arbeid mot kampfiksing http://t.co/xTYAMVUE5h http://t.co/SLzTRCnT3w
612384190714261504,2015-06-20 22:19:03,"Kripos_NCIS",RT @INTERPOL_HQ: INTERPOL Chief highlights #Norway role in international law enforcement cooperation against #security threats http://t.co/…
613056637985816576,2015-06-22 18:51:07,"Kripos_NCIS",Det norske bidraget til Frontex' Operasjon Triton har i ettermiddag og kveld reddet over 600 migranter i Middelhavet http://t.co/wVI6QWFT3G
613057797144580096,2015-06-22 18:55:43,"Kripos_NCIS","Alle migrantene blir tatt godt vare på av mannskapet, sier styrkesjef Tore Barstad. http://t.co/BDKKK4Me4w"
613299157210656768,2015-06-23 10:54:48,"Kripos_NCIS","Espen Erdal tilsatt som leder for den nyopprettede enheten for alvorlige, uoppklarte saker ved Kripos, ""cold case"" https://t.co/FlRQ4KSCFE"
613362614136143872,2015-06-23 15:06:57,"Kripos_NCIS",Siem Pilot er trolig i havn i Sicilia onsdag morgen. Bilde tatt av styrkesjef i e.m #OPTriton http://t.co/awJDDwkHWU
613363997610496000,2015-06-23 15:12:27,"Kripos_NCIS",Migrantene får blant annet salt-og sukkerholdig væske av mannskapet ombord. #OPTriton http://t.co/LvBqhZScA8
613438318110461953,2015-06-23 20:07:46,"Kripos_NCIS",Møt Espen Erdal: http://t.co/5IhNvFHvR9 #coldcase
613700129044963328,2015-06-24 13:28:07,"Kripos_NCIS",Rundt 770 migranter har nå forlatt Siem Pilot og gått i havn i Palermo #OPTriton http://t.co/9FvRIkfdid
613700729715474432,2015-06-24 13:30:30,"Kripos_NCIS",I Palermo blir migrantene registrert av italienske myndigheter. Også Røde Kors m.fl på plass #OPTriton http://t.co/FJ3wExx4F1
614000187334389760,2015-06-25 09:20:26,"Kripos_NCIS",Europol offentliggjør i dag en av de største politi-satsingene mot datakrim noensinne. Flere saker også i Norge: https://t.co/WTfeEBRVVg
614013509823778816,2015-06-25 10:13:23,"Kripos_NCIS",RT @NorCERT: Kripos stanset nettbankangrep mot DNB @Kripos_NCIS @DN_no http://t.co/LIN4NUV1R8
615283284562550784,2015-06-28 22:19:01,"Kripos_NCIS",Mannskapet på Siem Pilot har reddet over 80 migranter fra en gummibåt og tatt om bord ca. 330 migranter fra et skip fra Leger uten grenser.
615761161108099072,2015-06-30 05:57:55,"Kripos_NCIS",Siem Pilot har lagt til havn i Catania og forbereder overlevering av over 400 migranter til italienske myndigheter. http://t.co/4ZfxBhPOPk
615894165319254016,2015-06-30 14:46:26,"Kripos_NCIS",Når migrantene tas om bord i Siem Pilot blir de plassert i to soner. Kvinner og barn i en sone og menn i en annen. http://t.co/sbX130VAsS
616189000311787520,2015-07-01 10:18:00,"Kripos_NCIS",Vi har publisert tre videoer fra redningsaksjonen 28. juni. Videoene viser hvordan dykkere fra @Forsvaret_no jobber. https://t.co/Xg1R6hxm5G
616548502512996352,2015-07-02 10:06:32,"Kripos_NCIS",Erling Olstad er ny styrkesjef for Norges bidrag til Operasjon Triton. https://t.co/n99HDFRFWT http://t.co/nPVK0Ovuye
616872918946050048,2015-07-03 07:35:39,"Kripos_NCIS",Mannskapet på Siem Pilot har siden 12. juni reddet 70 barn i Middelhavet. http://t.co/M0s6hgNvqw
618105539818594304,2015-07-06 17:13:39,"Kripos_NCIS","I kveld er styrkesjef for Norges bidrag til operasjon Triton, Tore Barstad, gjest på #godsommernorge."
619116274224861184,2015-07-09 12:09:57,"Kripos_NCIS",Mannskapet på Siem Pilot reddet onsdag 286 migranter i Middelhavet. Fartøyet sank kort tid etter redningsoperasjonen. http://t.co/7fdsfQuryF
619492450235752448,2015-07-10 13:04:44,"Kripos_NCIS",Mann tiltalt for bl.a en rekke overfalls-overgrep begått over flere år. Omfattende beslag. Rettssak til høsten http://t.co/Jh5Ig348Tw
622399020166709249,2015-07-18 13:34:24,"Kripos_NCIS","Etter nærmere to døgn ombord i Siem Pilot, overføres idag 451 migranter til italienske myndigheter på Sardinia. http://t.co/vgLLSqx2c6"
623123283567730688,2015-07-20 13:32:22,"Kripos_NCIS","I disse dager settes fartøyet ""Peter Henry von Koss"" fra @NSSR inn i Operasjon Poseidon i Hellas.Les mer på politi.no http://t.co/YakvXfRXJu"
623381913957462016,2015-07-21 06:40:04,"Kripos_NCIS",På 15 mnd skjedde det fire drap i Sunnmøre politidistrikt. Les om hvordan politiet jobbet her: http://t.co/kaDyYp3CG6
624826542091317248,2015-07-25 06:20:31,"Kripos_NCIS","785 migranter går nå i land i Palermo, Sicilia. Ble reddet torsdag og tatt videre ombord i Siem Pilot #OPTriton http://t.co/bhiljlQOAh"
624827485063106560,2015-07-25 06:24:15,"Kripos_NCIS",27 barn har vært på Siem Pilot siden torsdag. Kosebamsene som mannskapet hadde med fra Norge blir tatt godt imot. http://t.co/DhBpNFM3F4
625670099584819200,2015-07-27 14:12:30,"Kripos_NCIS",Første norske redningsaksjon utenfor Hellas #Poseidon. 14 migranter reddet mandag. Se https://t.co/0nBWJQe2Hm @NSSR http://t.co/Vsaci2n6J8
625686208606302208,2015-07-27 15:16:31,"Kripos_NCIS",@felixfeatures vi opplever stor etterspørsel etter bilder og forsøker å gjøre gode avveininger i samarbeid med bl. a Frontex og styrkesjef.
625988777371136000,2015-07-28 11:18:49,"Kripos_NCIS",I dag tar Lise Dunham fra @politietoslo over som styrkesjef på Siem Pilot. http://t.co/N7ejNQGBHG
627088834753376256,2015-07-31 12:10:03,"Kripos_NCIS",Siem Pilots sjette redningsaksjon: Reddet over 90 barn og 300 voksne. Det norske bidraget har reddet 3100 siden juni. http://t.co/IEBEHNB8VQ
627097756969082880,2015-07-31 12:45:30,"Kripos_NCIS","390 migranter gikk i dag i land i Brindisi, Italia. 92 barn, flere spedbarn. En født på migrantbåten #Siem Pilot http://t.co/lD1CidEPrH"
628136880706600960,2015-08-03 09:34:37,"Kripos_NCIS",Fersk FN-rapport om hvordan barn utnyttes gjennom ny teknologi @UNODC https://t.co/a6zT2BRSiQ
628529968528670721,2015-08-04 11:36:36,"Kripos_NCIS","395 migranter ble mandag tatt ombord i Siem Pilot etter en ny redningsaksjon. 154 barn, mange under fem år. http://t.co/CfBwy9dgDP"
628866073681596416,2015-08-05 09:52:10,"Kripos_NCIS",114 migranter ble i morges reddet av den norske redningsskøyta i Hellas. Flere lå i vannet. Alle bragt til Lesbos. http://t.co/j6XEq2qwyg
629216175520677888,2015-08-06 09:03:21,"Kripos_NCIS",43 migranter i 1 gummibåt reddet av den norske redningsskøyta. Bragt til Lesbos i natt. Yngste ombord var 4 mnd. http://t.co/QzNHhQlpY2
629678605937852416,2015-08-07 15:40:53,"Kripos_NCIS",Politiet ber om tips etter at en eldre kvinne ble utsatt for overgrep i hjemmmet sitt på Sula 16.juli http://t.co/84KhHKhlhb
629901264411840512,2015-08-08 06:25:39,"Kripos_NCIS","Siem Pilot har siden natt til fredag hatt 800 på dekk, etter nye redninger. Går i land i Reggio lørdag morgen. http://t.co/ize56m6KnQ"
629984016251396096,2015-08-08 11:54:28,"Kripos_NCIS","Over 90 migranter reddet i land av ""Peter Henry von Koss"" lørdag.Den yngste 2 år. Høye bølger og vind utenfor Lesbos. http://t.co/vWGEJ5d7lR"
630264836602118144,2015-08-09 06:30:21,"Kripos_NCIS",Per 9.8 er det reddet 263 migranter av den norske redningsskøyta i Hellas. Det er reddet 4300 migranter av Siem Pilot i Italia.
631404112207343616,2015-08-12 09:57:25,"Kripos_NCIS",Nå drar Kjernekar-kampanjen ut til studiesteder over hele landet. Se mer på https://t.co/McNC8DIisZ http://t.co/rgwe8jwxJj
631737505759555584,2015-08-13 08:02:13,"Kripos_NCIS",Kripos og @Saltenpolitiet har aksjonert mot et narkotikamiljø i Bodø og omegn. Sju personer er pågrepet. https://t.co/qE1MMueCRj
632118512895590400,2015-08-14 09:16:12,"Kripos_NCIS",Markant økning i antall kokainbeslag. Se hele narkotikastatistikken for 1. halvår 2015 her: https://t.co/DS6yo4QXGg http://t.co/7crgwuwKdp
632625974501376000,2015-08-15 18:52:40,"Kripos_NCIS",Siem Pilot har i dag tatt i mot ca. 300 overlevende og 40 døde. Les mer: https://t.co/JDCayzdMdu http://t.co/R81KMxve2V
632984503745662976,2015-08-16 18:37:20,"Kripos_NCIS",I går bistod Siem Pilot i to redningsoppdrag. Nå er skipet på vei til Catania med 416 migranter og 49 døde om bord. http://t.co/VkKemJwKSM
633995376488488961,2015-08-19 13:34:11,"Kripos_NCIS","Seks personer dømt i stor narkotikasak. Til sammen 30kg kokain, 204kg hasj og 1kg amfetamin: https://t.co/pRa9UmULhe http://t.co/keqs5PsQwY"
634007415109877760,2015-08-19 14:22:01,"Kripos_NCIS",Siem Pilot: Øvelse på evakuering via helikopter med den italienske kystvakten. http://t.co/xKLlIJxtvn
634742640630726656,2015-08-21 15:03:33,"Kripos_NCIS",Peter Henry von Koss har i natt og i dag reddet 93 migranter i havsnød. De har også tatt om bord en død person. http://t.co/QnUggbZxKH
634983700372062208,2015-08-22 07:01:26,"Kripos_NCIS",Siem Pilot er på vei mot et område med flere migrantbåter i havsnød. TV2 og Aftenposten rapporterer fra skipet. http://t.co/CLHqwTDOWH
635055628344532992,2015-08-22 11:47:15,"Kripos_NCIS",Siem Pilot har reddet ca 320 migranter fra en fiskebåt. Mange nødanrop i området og skipet på vei mot nytt oppdrag. http://t.co/0RgVewbZPn
635078547170791425,2015-08-22 13:18:19,"Kripos_NCIS",@brdsyrstad @Oijans det er hovedredningssentralen i Italia som vurderer nødmeldingene og gir oss oppdrag.
635102824897073152,2015-08-22 14:54:47,"Kripos_NCIS",Svært mange nødanrop i vårt område og Siem Pilot tar fortsatt ombord migranter.Våre lettbåter på vei til ny gummibåt. http://t.co/GzDuBhQxFu
635161031279570945,2015-08-22 18:46:05,"Kripos_NCIS",Siem Pilot setter nå kursen nordover med over 950 migranter ombord. Migranter fra 3 ulike redningsoppdrag er med. http://t.co/lowyfHyLNo
635418712594587649,2015-08-23 11:50:01,"Kripos_NCIS",Etter siste fintelling sent i går er det totalt 963 migranter på Siem Pilots dekk. 71 av dem er barn. http://t.co/CH4pg1pcZH
635844984940400642,2015-08-24 16:03:52,"Kripos_NCIS",I morges forlot over 960 migranter Siem Pilot. På bildet styrkesjef Lise Dunham og militær rådgiver Odvin Nilsen. http://t.co/D0lRkla3we
637542253788008448,2015-08-29 08:28:12,"Kripos_NCIS",I dag morges ble to døde personer overført fra et italiensk marinefartøy til Siem Pilot. http://t.co/lFARKMhWLQ
637542484344705024,2015-08-29 08:29:07,"Kripos_NCIS","Det er uklart hva som har skjedd, men de bærer preg av å ha ligget lenge i sjøen. Politiet om bord følger norsk standard for ID-arbeid."
637634128209383425,2015-08-29 14:33:17,"Kripos_NCIS",I kveld er Siem Pilots styrkesjef Lise Dunham gjest på @nrklindmo kl. 21.55. http://t.co/5GFot1NU5w
638783857853075456,2015-09-01 18:41:54,"Kripos_NCIS","I dag ble 781 migranter og fire døde overført til Siem Pilot. 11 barn, 175 kvinner og 595 menn. #frontex http://t.co/hY4IgcZYHf"
638951262369792000,2015-09-02 05:47:06,"Kripos_NCIS",Migrantene overføres til Siem Pilot på lettbåter som er bemannet av personell fra Forsvaret og politiet. http://t.co/kR2nOdXYow
639030438808408064,2015-09-02 11:01:43,"Kripos_NCIS",Sverre Sørberg er ny styrkesjef på redningsskøyta i Hellas. I går ble nye 52 personer reddet i land @NSSR http://t.co/WHKBaxIpfM
639333540463820800,2015-09-03 07:06:08,"Kripos_NCIS",Siem Pilot i Cagliari. Overfører nå 781 migranter til italienske myndigheter. Seks døde overføres til slutt. http://t.co/GSZbPY9HqZ
639335741319987200,2015-09-03 07:14:53,"Kripos_NCIS",De syke overføres først. Deretter kvinner og barn. Mennene går i land til slutt. http://t.co/a5Rs1QaS6v
639358969153241088,2015-09-03 08:47:11,"Kripos_NCIS",Nye områder på http://t.co/mXISjsjuuG: Nasjonalt kontaktpunkt for bombekjemikalier og Radikalisering og voldelig ekstremisme på Internett.
639371732172845056,2015-09-03 09:37:54,"Kripos_NCIS",Siem Pilot er delt inn i en rød og en grønn sone. Det er et strengt regime for å hindre at mannskapet blir smittet. http://t.co/YRw2yyCKz3
639429247610810368,2015-09-03 13:26:27,"Kripos_NCIS",@runasand skjønner hva du mener. Dette er en utvidelse av en gml løsning. Vi håper å lage ny versjon etterhvert. Ta gjerne kontakt.
639430717563400193,2015-09-03 13:32:17,"Kripos_NCIS",@runasand kripos.info@politiet.no
639803749901443072,2015-09-04 14:14:35,"Kripos_NCIS",Flytende mikromerking er en ny metode mot vinningskriminelle. Les mer https://t.co/m5AdOUzeXk http://t.co/VC7q2qtMkE
640924287101222912,2015-09-07 16:27:12,"Kripos_NCIS","- Vi vil forlenge Siem Pilots oppdrag med 3 mnd, mlg 6 mnd hvis Frontex vil, sa @erna_solberg på @Kripos_NCIS i dag. http://t.co/MwKoRdQAJ3"
640945681369333761,2015-09-07 17:52:13,"Kripos_NCIS",Statsministeren fikk i dag høre mannskapet fortelle om opplevelsene på Siem Pilot @Kripos_NCIS http://t.co/5nc94Gd6yB http://t.co/9xUccyhLex
640964961561387008,2015-09-07 19:08:50,"Kripos_NCIS","RT @Politiforum: Kripos utvider den ""røde knappen"". Nå kan folk tipse om bombekjemikalier og radikalisering/voldelig ekstremisme: http://t.…"
641231527486038017,2015-09-08 12:48:04,"Kripos_NCIS","50 personer reddet av ""Peter Henry von Koss"" ved Lesbos i morges, 15 barn. Den yngste 2-3 mnd. http://t.co/rqYWYPpvdF"
643793385732591616,2015-09-15 14:27:58,"Kripos_NCIS","En av matrosene på Siem Pilot savnet siden tidlig mandag på Catania. Det er lett på land og i sjøen, dessv. foreløpig uten å finne ham."
644256949891137536,2015-09-16 21:10:01,"Kripos_NCIS",Matrosen som var savnet fra Siem Pilot kom onsdag kveld til rette. Han får nå tilsyn og er gjenforent med sin familie.
644818506819739648,2015-09-18 10:21:26,"Kripos_NCIS",Flytende mikromerking er en ny metode mot vinningskriminalitet. Se hvordan verdisakene kan sikres her: http://t.co/MX7QEewayW
645250596421902336,2015-09-19 14:58:25,"Kripos_NCIS",RT @Lenareif: Det norske mannskapet og RS sin båt PHVK gjør daglig en viktig jobb i Middelhavet. Her en reportasje fra Sky News http://t.co…
645275057816735744,2015-09-19 16:35:37,"Kripos_NCIS",Siem Pilot har i dag reddet 336 migranter fra en fiskebåt. 1 person alvorlig skadd og evakuert med helikopter. http://t.co/rBsQWSiTbx
645276773433872385,2015-09-19 16:42:26,"Kripos_NCIS","Migrantene som ble reddet i dag tas nå hånd om på Siem Pilot. Kurs mot Sicilia, forventet ankomst søndag morgen. http://t.co/JXJl6187Th"
646660321390784512,2015-09-23 12:20:09,"Kripos_NCIS",En person er fortsatt savnet etter søk utenfor Lesbos i går kveld. Ni migranter funnet og reddet av redningsskøyta. http://t.co/vIvsXSwNyX
646702688240050177,2015-09-23 15:08:30,"Kripos_NCIS",RT @FrontexEU: Norwegian vessel Peter Henry von Koss rescued 9 people floating in sea east of Lesbos. #PoseidonSea http://t.co/Q5mpxkXUWf
647363068691906560,2015-09-25 10:52:37,"Kripos_NCIS","Sterke inntrykk utenfor Lesbos også denne uka. Stor takknemlighet blant de som reddes, sorg for de man ikke finner. http://t.co/aor3gRlc4K"
648480160090615810,2015-09-28 12:51:33,"Kripos_NCIS",Flytende mikromerking vant sikkerhetspris https://t.co/EAq9qbqPQX. Video om hvordan metoden virker: http://t.co/MX7QEewayW
648741920722784256,2015-09-29 06:11:41,"Kripos_NCIS",RT @FrontexEU: Frontex vessel involved in the rescue of 487 migrants in Italy over the weekend http://t.co/4YXqEqiZfo
649991551691702272,2015-10-02 16:57:16,"Kripos_NCIS",RT @Lenareif: Det er besluttet at Voldteksgruppa blir en permanent seksjon i @Kripos_NCIS. Lederstillingen er lyst ut. Frist 7.10  http://t…
650668991581691904,2015-10-04 13:49:11,"Kripos_NCIS",Hva er fiktiv ID? Her får du vite mer om et tiltak som passer for noen svært få trusselutsatte: http://t.co/1MPo33UexK
650959071881883648,2015-10-05 09:01:51,"Kripos_NCIS",12.15 forteller Bjørn-Erik Ludvigsen fra Kripos om hvordan Kripos jobber mot overgrep av barn på nett.   http://t.co/DN3IFomeh6
651351848406880256,2015-10-06 11:02:36,"Kripos_NCIS",Siem Pilot satt i land 239 migranter i Messina i dag. De to norske båtene har samlet reddet 718 barn i Middelhavet http://t.co/yLhWoSeyQj
652612366782345216,2015-10-09 22:31:27,"Kripos_NCIS","Militær rådgiver på Siem Pilot, Odvin Nilsen, forteller om samarbeidet mlm politi og @Forsvaret_no https://t.co/VNvsq4sVmE #operasjonTriton"
654525485511278593,2015-10-15 05:13:30,"Kripos_NCIS","Straks i Nyhetsmorgen: Raymond Thorsen fra Kripos om politiets nye kampanje ""Hvor lite"". Sjekk ut hvorlite.no. http://t.co/jQplsmgaKi"
654558186880520192,2015-10-15 07:23:27,"Kripos_NCIS",I dag lanserer politiet kampanjen Hvor lite skal du finne deg i? for å forebygge vold i nære relasjoner. hvorlite.no http://t.co/Ogwct27IrK
654574405843054592,2015-10-15 08:27:54,"Kripos_NCIS",@haabe på hvorlite.no finner du mer informasjon om kampanjen.
654594404901122049,2015-10-15 09:47:22,"Kripos_NCIS","@geirilja1 Vi vet at vold i nære relasjoner utøves av begge kjønn, av folk i alle aldre. Det meste av kampanjemateriellet er kjønnsnøytralt."
654602477468303362,2015-10-15 10:19:27,"Kripos_NCIS",@geirilja1 @SOrstavik Statistisk er kvinner oftere utsatt for gjentagende alvorlig vold og seksuelle overgrep fra sin partner enn menn.
654634871432855552,2015-10-15 12:28:10,"Kripos_NCIS",Evalueringen av norske myndigheters behandling av Bergwall-sakene ble lagt fram i dag. Hele rapporten her: http://t.co/IVhYj9DHOn
655772669237927937,2015-10-18 15:49:22,"Kripos_NCIS","Mange barn reddet utenfor Lesbos denne uka. Over 1000 migranter tatt ombord i ""Peter Henry von Koss"" siden juli. http://t.co/mNshZ6n0dv"
656046716349763584,2015-10-19 09:58:20,"Kripos_NCIS",664 migranter går i dag i land i Cagliari på Sardinia. De ble reddet lørdag og tatt ombord i Siem Pilot. #OPTriton http://t.co/BYtmOW3DZl
656474363378704384,2015-10-20 14:17:39,"Kripos_NCIS",Hvor lite skal du finne deg i ? @StineRenate skriver om politiets nye kampanje https://t.co/lftU8hY90j: https://t.co/Yo73Xv0gFG
656742729456754689,2015-10-21 08:04:03,"Kripos_NCIS",Politiaksjonene på Østlandet pågår utover dagen. Det vil bli gitt mer informasjon i ettermiddag.
656785285888479232,2015-10-21 10:53:09,"Kripos_NCIS","Det blir pressekonferanse om dagens aksjoner hos Kripos kl. 15. Økokrim, Nav og Skatteetaten vil også være tilstede."
656827011848085504,2015-10-21 13:38:57,"Kripos_NCIS",18 pågrepet så langt i politiaksjoner mot et miljø tilknyttet transport og renholdsbransjen https://t.co/wyAYQmD5YK https://t.co/J7qpxw07jn
658976906235219969,2015-10-27 12:01:52,"Kripos_NCIS",Tre personer er siktet etter paragraf 60a.  https://t.co/jIJVYwtDiN«mafiaparagrafen»-11731985.ece
659464491457978369,2015-10-28 20:19:21,"Kripos_NCIS",Mannskapet på Peter Henry Von Koss i dramatisk redningsaksjon utenfor Lesvos. De reddet 122 personer. To av barna de reddet opp var døde.
659699968488431616,2015-10-29 11:55:03,"Kripos_NCIS",Fra gårsdagens redningsaksjon: De klarte å redde 122. Flere barn var kritisk nedkjølt. I dag skal de ut igjen.@NSSR https://t.co/XuPEzc8GjS
660023466633142272,2015-10-30 09:20:31,"Kripos_NCIS",Eritreisk dans og sang på Siem Pilot. Torsdag reddet mannskapet over 820 migranter.  Til sammen har de reddet 9200. https://t.co/J196DvCsLA
660070406838177793,2015-10-30 12:27:03,"Kripos_NCIS","Regjeringen vil forlenge innsatsen til ""Peter Henry von Koss"" fram til sommeren 2016: https://t.co/BZauLRnZjW #PoseidonSea"
660109027859386368,2015-10-30 15:00:31,"Kripos_NCIS",I tillegg kommer andre bevilgninger som følge av økt migrasjon til Norge.
661234893737865216,2015-11-02 17:34:18,"Kripos_NCIS","– Vi har snart et samfunn som gjennomsyres av bransjer som driver ulovlig, advarer avd.leder Eivind Borge. https://t.co/uSgAgfV8Kj"
661829858486538240,2015-11-04 08:58:29,"Kripos_NCIS","Redningsskøyta reddet over 100 migranter ved Lesbos i går. Tre druknede tatt opp i båten, blant dem gutt ca ett år. https://t.co/t6izcmjgH9"
662653671373697024,2015-11-06 15:32:01,"Kripos_NCIS",Ketil Haukaas har i statsråd i dag fått forlenget sin stilling som Sjef Kripos ut 2016 https://t.co/ywOihwzpF1 https://t.co/IxbhuIraxx
663095729771163648,2015-11-07 20:48:36,"Kripos_NCIS",@PippAgain Hei! Husk at du gjerne kan bruke vår tipsportal https://t.co/mXISjsjuuG
663259291621703680,2015-11-08 07:38:32,"Kripos_NCIS",Mannskapet på Peter Henry Von Koss er i gang med sitt 73. oppdrag. Søker nå etter en død person i vannet. @NSSR https://t.co/3sBslYpm9J
663273346289770496,2015-11-08 08:34:23,"Kripos_NCIS",Mannskapet avslutter søket etter død person utenfor Lesvos. Viste seg å være en ryggsekk og en redningsvest. @NSSR https://t.co/cOJPftjg2Z
664357280008286208,2015-11-11 08:21:33,"Kripos_NCIS","""Trendrapporten 2016: Om organisert og annen alvorlig kriminalitet"" er publisert på https://t.co/Uq0SnErqe0"
664558802721775616,2015-11-11 21:42:20,"Kripos_NCIS",I dag skrev @btno feilaktig om Espen Erdal. Her forklarer han sin rolle og hvordan cold case-enheten skal jobbe: https://t.co/sEWMPGksTe
664748665177825280,2015-11-12 10:16:46,"Kripos_NCIS",Det er fortsatt uavklart når våre fagfolk kan begynne undersøkelser på brannstedet i Hemsedal. Lokalt politi styrer arbeidet.
664750798090477568,2015-11-12 10:25:15,"Kripos_NCIS",.@GeirIngeFiske dette handler om når det er hensiktsmessig og at ting gjøres i riktig rekkefølge. Må for eks være kaldt på brannstedet.
665486149868249088,2015-11-14 11:07:16,"Kripos_NCIS",Siem Pilot setter i dag 407 migranter i land i Catania. Reddet nord for Libya. De fleste fra land i vest-Afrika. https://t.co/RdaBK3WdQy
665491944886427648,2015-11-14 11:30:18,"Kripos_NCIS",Paris-terroren: Info fra @Politidir på https://t.co/xiqAHUCI1B og fra @PSTnorge på https://t.co/n4TZj1iDL2
666218193036427264,2015-11-16 11:36:09,"Kripos_NCIS",RT @Politiforum: Cold case-gruppa i Kripos klare for å ta imot uoppklarte saker. Flere politidistrikter har allerede kontaktet dem. https:/…
667603307968466944,2015-11-20 07:20:06,"Kripos_NCIS",Kripos har siste måneden hatt en egen patrulje på Facebook. Den svarer på hva som er lov og ikke lov på internett https://t.co/lyEyNvueVG
669258634254262276,2015-11-24 20:57:47,"Kripos_NCIS",RT @Justisdep: Regjeringen innfører midlertidig grensekontroll - skal stoppe personer uten nødvendige reisedokumenter  https://t.co/Cforn6F…
