791631079270744068,2016-10-27 13:22:11,"Kripos_NCIS","""Snapchat-saken"" i Høyesterett: Prinspiell sak om nedlasting og spredning av andres intime bilder. Viktig å få avklart straffenivå. https://t.co/7COTu3Tv6K"
792005649697767424,2016-10-28 14:10:36,"Kripos_NCIS",Norsk politi samlet mot narkotika. Riksadvokaten holder foredrag på fagseminar om narkotika. https://t.co/lLgiVPHY4n
792027320269869061,2016-10-28 15:36:42,"Kripos_NCIS","Pris til ""Hvor lite skal du finne deg i?"" Om noen dager er kampanjen i gang igjen. Følg med! https://t.co/J9UY6WMm0C https://t.co/97ou4SqyYe"
793002665370329088,2016-10-31 08:12:23,"Kripos_NCIS",Ingen skal behøve å frykte sine nærmeste. Sjekk faresignaler og hvordan du kan søke hjelp på politikampanjen https://t.co/lftU8hY90j https://t.co/8eioA3NZAh
793027898072506368,2016-10-31 09:52:39,"Kripos_NCIS",Bergen tingrett: I dag starter rettssaken mot en mann tiltalt for bl.a direkteoverførte overgrep fra Filippinene. Over seksti fornærmede. https://t.co/MvdIRjzs51
793158399215144961,2016-10-31 18:31:13,"Kripos_NCIS","Absolutt. Godt innspill. Kampanjen retter seg særlig mot unge i etableringsfasen, men budskapet gjelder alle uansett alder @Parorendeaksjon"
793476200891027456,2016-11-01 15:34:03,"Kripos_NCIS","Tusvik &amp; Tønne snakker om ""Hvor lite skal du finne deg i?"" på podcasten sin denne uka. Sjekk faresignaler på https://t.co/lftU8hY90j. https://t.co/TRIys306Q8"
793514220256100352,2016-11-01 18:05:07,"Kripos_NCIS",RT @eJenss: Politiets nettpatrulje fyller ett år i dag. Gratulerer med dagen! @Kripos_NCIS https://t.co/pzCiR2Hyxh https://t.co/FMVCFFqnKT
793822742185410560,2016-11-02 14:31:04,"Kripos_NCIS",".@OPSostfinnmark har laget sin lokale variant av ""Hvor lite skal du finne deg i?"" i samarbeid med engasjert ungdom og med samiske tekster. https://t.co/PVG210iJOo"
793824684760559616,2016-11-02 14:38:48,"Kripos_NCIS",@BjrnOveStrand @breakingnews_no @OPSostfinnmark her ligger resten av videoen: https://t.co/cVJMm1m5ja
793853914856775684,2016-11-02 16:34:57,"Kripos_NCIS",Siem Pilot har nå 29 levende og 12 døde ombord. Gummibåt med migranter hadde veltet nord for Libya. Tre små barn blant de døde. https://t.co/GVIOLajGL6
793854117630373889,2016-11-02 16:35:45,"Kripos_NCIS",Det var angivelig mellom 120 og 140 personer i gummibåten. Det blir søkt etter savnede.
793863257148850176,2016-11-02 17:12:04,"Kripos_NCIS",Siem Pilot går nå nordover. Andre skip fortsetter søket. Flere ombord som trenger medisinsk hjelp.
794076435874979840,2016-11-03 07:19:10,"Kripos_NCIS",Ingen skal behøve å være redd for kjæresten sin. Finner du deg i for mye? Les mer og sjekk faresignaler på https://t.co/rIdVa8AFrI. https://t.co/jdFkB3jQdX
795345406507053056,2016-11-06 19:21:36,"Kripos_NCIS",RT @Europol: #Doyouknow what a Joint Investigation Team (JIT) is? https://t.co/E9ymKx0mLx
795530240097394688,2016-11-07 07:36:04,"Kripos_NCIS",Ikke all vold er synlig. Vold mellom voksne skader også barnet. Lær mer om vold i nære relasjoner på https://t.co/rIdVa8AFrI https://t.co/5rL5vyVMq8
796307134413762560,2016-11-09 11:03:10,"Kripos_NCIS",Høyesterett med viktig dom i Snapchat-saken.   Ikke del intime bilder uten lov.  https://t.co/bVZCQo5ZbO  @sondrolsen 👇🏻 https://t.co/8JZXGSU3Xd
796311118805434368,2016-11-09 11:19:00,"Kripos_NCIS","@felixfeatures @sondrolsen Antall fornærmede har betydning for utmålingen av straff, men å si noe om hvor mye er vanskelig."
796313451316609024,2016-11-09 11:28:16,"Kripos_NCIS",@AltMuligRart @sondrolsen I disse typer saker - der man identifiserer og henger ut jenter - så er det nesten unntak gutter.
796314852205727744,2016-11-09 11:33:50,"Kripos_NCIS","@elfhybrid_ Det gjelder alle,men spesielt gutter. I disse sakene - der jenter identifiseres og henges ut - er det nesten uten unntak gutter"
796371321202601987,2016-11-09 15:18:13,"Kripos_NCIS","@Rawpower67 @sondrolsen loven er kjønnsnøytral. I disse sakene, der jenter identifiseres og henges ut, så er det nesten uten unntak gutter."
796638066001772544,2016-11-10 08:58:10,"Kripos_NCIS",Det første slaget et sjelden det siste. Søk hjelp på https://t.co/lftU8hY90j. https://t.co/15Gn0iXZil
796662319044501504,2016-11-10 10:34:32,"Kripos_NCIS",Har du nakenbilder av andre personer uten deres samtykke? Da bør du slette dem. Høyesterett har slått fast at det er ulovlig. https://t.co/2Nnn2qOqIc
796735723902738433,2016-11-10 15:26:13,"Kripos_NCIS",", @MarteKirkerud her finner du dommen fra @hoyesterett_no om ulovlig nedlasting og spredning https://t.co/lTsQWNfhfb"
798550868358561792,2016-11-15 15:38:58,"Kripos_NCIS","Pågripelsene på Dokka: Kripos vil fortsatt bistå Innlandet Pd i drapssaken på Søndre Land, blant annet med e-ledelse og avhør."
798551490264788992,2016-11-15 15:41:26,"Kripos_NCIS",Saken har vært høyt prioritert siden drapet skjedde. Omfattende bistand og godt samarbeid med ansvarlig distrikt.
798818116234948609,2016-11-16 09:20:54,"Kripos_NCIS","Få slutt på volden, søk hjelp tidlig. https://t.co/9RopF1v0zT https://t.co/cqKEOdt9mk"
798853062219558912,2016-11-16 11:39:46,"Kripos_NCIS",Påstand om åtte års fengsel for mann tiltalt for en rekke nettovergrep i Norge og på Filippinene https://t.co/py7fWCBExQ
799611273554120709,2016-11-18 13:52:38,"Kripos_NCIS",Mange har delt sine erfaringer med oss. Vi håper flere enn før kjenner til faresignaler og hvor man kan søke help: https://t.co/lftU8hY90j https://t.co/tpSmPGS5Dh
799699038836756480,2016-11-18 19:41:23,"Kripos_NCIS",Dere er viktigere enn dere tror! Det pleier Kåre Svang fra Kripos å si når han reiser rundt og møter helsesøstre. https://t.co/IN6LlmaDzy
800364827164098561,2016-11-20 15:46:59,"Kripos_NCIS","OP Darkroom/Vest pd:Vår bistand har bl.a vært taktisk etterforskning og  etterforskingsledelse, elektroniske spor og internett-undersøkelser"
800635176644657152,2016-11-21 09:41:15,"Kripos_NCIS",Kripos’ beste råd: Slik beskytter du barna mot overgripere på nett - https://t.co/y7RqzNke0T
800811342672306176,2016-11-21 21:21:17,"Kripos_NCIS",Del gjerne denne med barna. Snakk om farer på nettet https://t.co/4HQNRskmNh
801045817075363840,2016-11-22 12:53:00,"Kripos_NCIS",Fire tyrkiske menn ble i natt anholdt mellom Tyrkia og Hellas mistenkt for mennskesmugling. @NSSR @Frontex https://t.co/zV02F9yx0E
801093692312485888,2016-11-22 16:03:14,"Kripos_NCIS",Mannskapene på Siem Pilot og Peter Henry Von Koss mottar Humanistprisen for 2016. https://t.co/JIqHkHoLeE
801447368684171264,2016-11-23 15:28:37,"Kripos_NCIS",Politiets medalje for internasjonal tjeneste ble i dag gitt til mannskapene på Siem Pilot og Peter Henry von Koss. Flott og verdig👮 https://t.co/K7BlXL3vQv
801776037503889408,2016-11-24 13:14:38,"Kripos_NCIS","Aksjon fra oktober 2015 er nå en sak med 76 siktede. Godt samarbeid med @Skattenmin, @okokrim @NAVnorge https://t.co/ZLA18IX9O8"
801849880532676608,2016-11-24 18:08:03,"Kripos_NCIS",RT @sondrolsen: Hvordan snakke med barn om overgrep? Følg med på @NRKDebatt i kveld! Politioverbetjent Kristian Tangen fra Kripos deltar.
801863034499112960,2016-11-24 19:00:19,"Kripos_NCIS",Videoen med Kristian Tangen har nesten 3 mill. visninger på Facebook. I dag er han gjest i #debatten der overgrep mot barn er tema. https://t.co/HY16nQrXjE
802840001964867584,2016-11-27 11:42:27,"Kripos_NCIS",Siem Pilot i redningsaksjon lørdag kveld. Seilbåt med 229 ombord - 159 menn og 70 kvinner reddet. @Frontex https://t.co/dYIX3mUaf3
804558261634691072,2016-12-02 05:30:12,"Kripos_NCIS",RT @torkallmyr: Mye og godt arbeid av gode kolleger i Nordfjord!  Det er gjort en fantastisk jobb med små ressurser https://t.co/Rs3T3uoQY3
805808753530507264,2016-12-05 16:19:12,"Kripos_NCIS",To menn dømt til fengsel for bl.a. DDoS-angrep. Aldri tidligere er noen ilagt så streng straff for den type angrep. https://t.co/InJVemd8tS https://t.co/GDlDKV8pnD
805863608680857600,2016-12-05 19:57:11,"Kripos_NCIS",Kripos bistår @AgderOPS med erfarne kriminalteknikere og drapsetterforskere. Vet du noe om drapene må du si ifra - https://t.co/6ocNiXpJPc
806440058651901952,2016-12-07 10:07:47,"Kripos_NCIS",Pressekonferanse ifb. Cold case-enhetens gjennomgang av Birgitte Tengs-saken på Politihuset i Haugesund klokka 12. https://t.co/SMA3tyDvmm
806455376736567296,2016-12-07 11:08:39,"Kripos_NCIS",Pressekonf. Vår vurdering er at det er konkrete etterforskningsskritt som bør følges opp - vi har tro på at saken kan oppklares. @EspenErdal
806802401176866816,2016-12-08 10:07:36,"Kripos_NCIS",Viktig dom i sak Kripos har etterforsket. Alle barn har rett til vern mot seksuelle overgrep - uansett land. https://t.co/veJqw1zW3U
807534788798251008,2016-12-10 10:37:51,"Kripos_NCIS",RT @Politihogskolen: Påtalejuristar får tilbod om vidareutdanning i tilrettelagte avhøyr. Nytt studie ved Politihøgskolen. https://t.co/xJ2…
808272764373204992,2016-12-12 11:30:18,"Kripos_NCIS",I dag lanserer @Europol en kampanje rettet mot unge som driver med datakriminalitet. https://t.co/y73Ew6d7tx
809753671424679936,2016-12-16 13:34:54,"Kripos_NCIS",Ketil Haukaas har i statsråd i dag fått forlenget sin stilling som Sjef Kripos https://t.co/SIyNBdbtXs https://t.co/QjUGjrmBfn
810227537620140032,2016-12-17 20:57:52,"Kripos_NCIS",Det heter ikke «barnepornografi» Bjørn-Erik Ludvigsen og Lisa Øyen Fjøsna i @Kripos_NCIS skriver i @Aftenposten  https://t.co/mRfIZhMdJ4
810451345908105216,2016-12-18 11:47:12,"Kripos_NCIS","@jkleiser Hei! I artikkelen brukes begrepet ""dokumenterte seksuelle overgrep"". Man kan også si overgrepsbilder eller filmer som viser overgrep."
811192116089131008,2016-12-20 12:50:46,"Kripos_NCIS","2 barn, 2 kvinner og 6 menn reddet av Peter Henry von Koss mlm Tyrkia og Lesvos. Svært kalde, men i god behold @Frontex @NSSR https://t.co/eM5qVvZe2J"
811938064612425729,2016-12-22 14:14:54,"Kripos_NCIS",Tusen takk til @vgnett og de som har stemt på Peter Henry von Koss og Siem Pilot som årets navn. En stor ære. https://t.co/ORPNIWh6Cd https://t.co/N1GleUeuxo
812233743205339137,2016-12-23 09:49:49,"Kripos_NCIS","Den vanskeligste kriminaliteten å bekjempe, er den vi ikke vet om. Vi ser tilbake på 2016 https://t.co/uwfhq2h4bF og ønsker alle en god jul. https://t.co/wvHJLBliT4"
812283222365192192,2016-12-23 13:06:26,"Kripos_NCIS",Godt norsk-italiensk politisamarbeid med støtte fra @Europol. Avverget videre utnyttelse på Internett https://t.co/etX14NrnhF
813677927778947072,2016-12-27 09:28:30,"Kripos_NCIS",22 migranter reddet fra gummibåt mlm Tyrkia og Lesvos i natt. Høy sjø. Tatt opp i Peter Henry von Koss. @NSSR @Frontex https://t.co/uC8m4Q1gdV
813678277311287296,2016-12-27 09:29:53,"Kripos_NCIS","Seks barn ombord. En eldre kvinne trengte førstehjelp. Var bevisstløs, men med puls. Hentet av ambulanse på land @NSSR @Frontex https://t.co/5HTlL8SFLV"
813726456958320640,2016-12-27 12:41:20,"Kripos_NCIS",Utsatt for kontroll og trusler? Sjekk faresignaler på https://t.co/lftU8hY90j https://t.co/XdyIbbCyLs
814795417233870848,2016-12-30 11:29:00,"Kripos_NCIS",Seksjon for elektroniske spor søker to dyktige medarbeidere med god og bred teknisk forståelse.  https://t.co/2TuadpQ1cs
816205683272060928,2017-01-03 08:52:53,"Kripos_NCIS",Ledig stilling som politiadvokat i Eurojust i Haag. https://t.co/DoLPYKEl48
816958893775581184,2017-01-05 10:45:53,"Kripos_NCIS","RT @EC3Europol: Connecting to free Wi-Fi doesn't always have to be dangerous, but only if you have a few safety considerations in mind. #st…"
818144322021376000,2017-01-08 17:16:21,"Kripos_NCIS",RT @Europol: Identity theft is big business for cybercriminals. Do you know how to protect your data? Check out these do's and don’ts! @EC3…
818830113055932417,2017-01-10 14:41:26,"Kripos_NCIS",.@leoajkic har vært om bord på Siem Pilot for å følge mannskapet og menneskene som reddes. #NrkFlukt   https://t.co/Yv85WLNj0t https://t.co/Iuxqz3IEsF
819129671153549312,2017-01-11 10:31:46,"Kripos_NCIS","Et langt yrkesliv i politiet avsluttes med fem perioder som styrkesjef på Siem Pilot. Takk for innsatsen, Geir Hilmarsen. @Frontex https://t.co/H6o67vTXez"
819613753855639557,2017-01-12 18:35:21,"Kripos_NCIS",En ny etterforskningsgruppe jobber nå med Birgitte Tengs-saken fra 1995. Tips politiet på 51899000 eller e-post tips.rogaland@politiet.no.
819619822568898560,2017-01-12 18:59:28,"Kripos_NCIS","RT @EspenErdal: Ny fase! Glad for å kunne bistå en svært kompetent etterf.gruppe i Sør-Vest pd med e-leder, analytiker og to etterforskere…"
820265093610999808,2017-01-14 13:43:32,"Kripos_NCIS",Styrkesjef Pål Erik Teigen forteller om hvordan mannskapet på Siem Pilot håndterer døde. Alle blir registrert. https://t.co/veUfMcHc2W
820935370518962176,2017-01-16 10:06:59,"Kripos_NCIS","MDMA (ecstasy) beslaglegges oftere enn før, og over hele landet. Statistikk over narkotikabeslag ute nå https://t.co/FsktfDILvo https://t.co/GgYW7HFRhB"
821016314437373954,2017-01-16 15:28:37,"Kripos_NCIS",I går overtok Siem Pilot fire overlevende og fire døde fra et fransk krigsskip. De overlevende forteller om et forlis med 170 personer. https://t.co/TRunRszgIC
821685214665646080,2017-01-18 11:46:36,"Kripos_NCIS",I dag gir vi ut drapsoversikten for 2016. 25 drapssaker med 27 ofre. Halvering siden 1991. Hvert drap er ett for mye https://t.co/P0oAJC18K7 https://t.co/nZiHGee1CF
821686676330254336,2017-01-18 11:52:24,"Kripos_NCIS","Vi er bekymret over andelen partnerdrap. Vold i nære relasjoner er et samfunnsproblem, ikke en privatsak.   - Vibeke Syversen, Kripos. https://t.co/sdLB05rDgS"
822389046353674240,2017-01-20 10:23:22,"Kripos_NCIS",Kripos' høringssvar til forslag om Digitalt grenseforsvar. Sentrale problemstillinger burde vært drøftet av utvalget https://t.co/BxJ5H0Y1rn
823630409942568962,2017-01-23 20:36:06,"Kripos_NCIS",Melding om båt med 80 migranter viste seg å være 374. Siem Pilot har til sammen tatt om bord 395 migranter i løpet av mandagen. @Frontex https://t.co/yMwOeYvrNx
823854981728108545,2017-01-24 11:28:28,"Kripos_NCIS","Rune Utne Reitan ledet i fire år den norske desken, @Europol og får politidirektørens medalje for utenlandstjeneste. Her med Sjef Kripos. https://t.co/muuyClZNb7"
823897502881615872,2017-01-24 14:17:26,"Kripos_NCIS","Flere anmelder seksuelle overgrep mot barn, viser nye tall: https://t.co/KlTAz837L1. Men fortsatt tror vi mange ikke tør å fortelle. Husk: https://t.co/rOcgV1wuNf"
823942896948748288,2017-01-24 17:17:49,"Kripos_NCIS","Hilde Reikrås mottar Dixi-prisen for arbeidet med Operasjon Dark Room. Beviser hvor viktig det er å grave dypere, for å hjelpe flere. https://t.co/77w8fUhpe6"
824291772616638467,2017-01-25 16:24:07,"Kripos_NCIS",Politiet trenger hjelp for å beskytte barn mot overgrep. Digitalt borgervern er ikke veien å gå. Slik bør du hjelpe: https://t.co/wHftjj7zP3 https://t.co/jnWzEk3wkK
824982784645222400,2017-01-27 14:09:57,"Kripos_NCIS","Viktig satsing i @Opssunnmore. Vi bistår med bl.a e-ledelse, avhør, id-arbeid og analyse. Disse sakene krever mye. https://t.co/K94Zw4fwDT"
826023689112023040,2017-01-30 11:06:08,"Kripos_NCIS",Kripos-kampanje nominert til årets kampanje under Social Media Days. Takker alle som er med å spre budskapet https://t.co/BykD8zWFoU https://t.co/0lrVsVAKz2
826356705206366212,2017-01-31 09:09:26,"Kripos_NCIS","RT @sondrolsen: Riksadvokaten orienterer - på nasjonalt fagseminar om vold i nære relasjoner, tema mishandling og alvorlig vold mot barn @K…"
826415336538984448,2017-01-31 13:02:24,"Kripos_NCIS",RT @sondrolsen: Pob. Kåre Svang ved @Kripos_NCIS understreker hvor viktig initialfasen er når politiet etterforsker saker med alvorlig vold…
826471495291568131,2017-01-31 16:45:34,"Kripos_NCIS",Tusen takk til Social Media Awards som valgte Kripos til finalist for årets kampanje #ikkehemmelig. Grattis til @Kreftforeningen som vant! https://t.co/vEI7MT31Ew
827071147317555200,2017-02-02 08:28:22,"Kripos_NCIS","Siem Pilot på vei mot Sicilia med 624 migranter ombord. Hektisk onsdag nord for Libya, med mange redningsaksjoner @Frontex https://t.co/WXJHdG8WqU"
827446728198647809,2017-02-03 09:20:47,"Kripos_NCIS",Vil du jobbe på Kripos? Fram til klokka 15 i dag er vi på @HiOA_info i Pilestredet. Vi møter deg som studerer ingeniør- og teknologifag👮 https://t.co/fHxA5nPqiD
827505973166272512,2017-02-03 13:16:12,"Kripos_NCIS",Utsatt for løsepengevirus? God info og hjelp her: https://t.co/755LHGWfxD
828905449403645953,2017-02-07 09:57:14,"Kripos_NCIS",Gjør ditt for at Internett er trygt og godt for alle! I dag....og resten av året #SIDNorway17 https://t.co/msiM7kj5Eu
829284464941531137,2017-02-08 11:03:18,"Kripos_NCIS",Et viktig samarbeid videreføres! I tospann med Næringslivets Sikkerhetsråd får vi et tettere samarbeid med utsatte bransjer. https://t.co/nWYQNhTzJC
830009248188874753,2017-02-10 11:03:20,"Kripos_NCIS",Europol satser tungt på å avdekke og forebygge datakrim og er en viktig samarbeidspartner for Kripos. Følg @EC3Europol og få gode råd. https://t.co/Jany6Y8z1W
831504370529398784,2017-02-14 14:04:25,"Kripos_NCIS",Kripos er kontaktpunkt for bombekjemikalier. Her kan du tipse: https://t.co/fdhFodAWWP. Les mer: https://t.co/G3rx9RgRED
831826334116671489,2017-02-15 11:23:47,"Kripos_NCIS",Drapsetterforsking i @politiagder: Kripos bistår med taktisk etterforskingsleder og kriminalteknikere.
832567996744863745,2017-02-17 12:30:53,"Kripos_NCIS",LEDIG STILLING: For å øke satsingen på kommunikasjonskontroll og avlytting søker vi etter erfarne medarbeidere. https://t.co/MsihbSH0uG
834773059886313472,2017-02-23 14:33:01,"Kripos_NCIS",RT @EC3Europol: Check out @childnet for resources to help children and young people #staysafeonline 📱💻 : https://t.co/1dgJVqLjUu https://t.…
835408739905712128,2017-02-25 08:38:59,"Kripos_NCIS",SIEM PILOT: 975 reddet i løpet av de siste dagene. Nå er 975 blitt 976. En liten gutt er født om bord. Alt bra med mor og barn. @Frontex https://t.co/TzUHefJwgv
836598798638010369,2017-02-28 15:27:51,"Kripos_NCIS",Justisminister Amundsen besøkte i dag flere av spesialistmiljøene ved Kripos. Her hos seksjon for brann og kjemi. https://t.co/0NQKVjKBuq
836606217057349634,2017-02-28 15:57:20,"Kripos_NCIS",LEDIG STILLING: Kripos styrker innsatsen mot seksuallovbrudd. Fem nye stillinger. Vil du være med på laget? https://t.co/jlU2L7WI9p
837578584810274816,2017-03-03 08:21:10,"Kripos_NCIS",Kripos ser med bekymring på at norske borgere bestiller sexdukker framstilt som barn. Samarbeid med @nyttfratoll https://t.co/wekkoKWrjL
837623065253134336,2017-03-03 11:17:55,"Kripos_NCIS",Kripos leder an i @Europol-aksjon mot deling av overgrepsmateriale på fildelingsnettverk. https://t.co/8Ma0o8KkwK https://t.co/k6FWyUuFSr
838307870970101760,2017-03-05 08:39:06,"Kripos_NCIS",Siem Pilot kom til Catania idag med 503 migranter. En døde ombord pga kronisk sykdom. To personer mistenkt som fasilitatorer. @Frontex https://t.co/sy4JiJTBFg
838759556410920960,2017-03-06 14:33:56,"Kripos_NCIS",RT @Frontex: Commander of Norwegian Siem Pilot deployed by #Frontex in Italy describes rescue operations in Central Med to Spanish journali…
838771291012366339,2017-03-06 15:20:34,"Kripos_NCIS",RT @sondrolsen: Kripos i spissen for Europol-aksjon med formål å forebygge overgrep mot barn/fildeling av overgrepsmateriale https://t.co/w…
839107894045966348,2017-03-07 13:38:06,"Kripos_NCIS",I dag er over 50 engasjerte etterforskere samlet på Kripos for å dele erfaringer og kunnskap om seksuelle overgrep mot barn på internett. https://t.co/eXmvjFrAad
839112681198059520,2017-03-07 13:57:07,"Kripos_NCIS","RT @Tannlegefor: Kåre Svang, @Kripos_NCIS: Opplysningsplikten overgår taushetsplikten - ferdig snakka! #Tannvernseminaret https://t.co/GLGB…"
839399727850455041,2017-03-08 08:57:45,"Kripos_NCIS",Ingen holdepunkter for for å anta at de beslaglagte dukkene kan ha noen forebyggende effekt mot seksuelle overgrep. https://t.co/NJdKZ2d3w8
839788390920912896,2017-03-09 10:42:09,"Kripos_NCIS",Det mørke nettet kan ikke være et fristed for alvorlig kriminalitet. Tre menn tiltalt for narkotikasalg. https://t.co/x4TnKlSJfx
839833016130285569,2017-03-09 13:39:29,"Kripos_NCIS",Kripos og Næringslivets sikkerhetsråd holder innlegg sammen om kriminalitetsutfordringer og samarbeid mellom priv. og off. sektor. https://t.co/ZBmdtfB8E2
841297964333182976,2017-03-13 14:40:39,"Kripos_NCIS","NY TIPSTJENESTE: Vet du om noe kriminelt som har skjedd, eller som du mistenker vil skje. Da må du tipse politiet. https://t.co/0KHa5bIyWn"
841310920441790464,2017-03-13 15:32:08,"Kripos_NCIS","@Sven_Randmael for en god del straffbare forhold, ja. Se https://t.co/DsljRFtQHh§196"
842303938112151552,2017-03-16 09:18:02,"Kripos_NCIS","RT @ckorme: Vært utsatt for ""CEO scams"" eller annen datakrim? Anmeld til politiet! KRIPOS har nå gjort det lettere https://t.co/M4EHpBIRxJ…"
842371668949495808,2017-03-16 13:47:11,"Kripos_NCIS",Takk @PF_offisiell for interessen og et godt besøk. Vi orienterte om et vanskelig budsjett. https://t.co/uUpS7pAWAd
842371672120406016,2017-03-16 13:47:11,"Kripos_NCIS",Philip Fossnes fra Kripos med foredrag om ID-arbeid etter store katastrofer for tysk politi. https://t.co/NcBfd7GWnM
842734879347544065,2017-03-17 13:50:27,"Kripos_NCIS","Kripos søker medierådgiver. Oppgaver: Pressehåndtering, kampanjearbeid og sosiale medier https://t.co/hmkmccFvoi https://t.co/9Gs7p64Ceg"
843701457270521861,2017-03-20 05:51:17,"Kripos_NCIS",Internasjonalt politisamarbeid fører til at også nordmenn må stå til ansvar for kriminalitet begått i andre land. https://t.co/uF1DkqHnqd
843854191835697153,2017-03-20 15:58:12,"Kripos_NCIS",Beslag påsmurt flytende mikromerking sporet til tyveri i Danmark. Metodeutvikling i samarbeid med næringslivet https://t.co/O3ZzFbQ7E3 https://t.co/d1sSpFhjT6
844212471367897093,2017-03-21 15:41:52,"Kripos_NCIS","Siem Pilot har siden mandag kveld deltatt i flere redningsoppdrag i Middelhavet. 673 migranter ombord, arbeidet pågår fortsatt. https://t.co/lHD5VYaSp7"
844212724599066625,2017-03-21 15:42:52,"Kripos_NCIS",Krevende værforhold. En død er overført fra et militært skip. https://t.co/udI4ASrWol
844271018965417984,2017-03-21 19:34:31,"Kripos_NCIS","Siem Pilot har nå 900 migranter ombord, etter over et døgn med redningsaksjoner i Middelhavet. En død person. En mann med brukket ankel. https://t.co/sizxZXHDN7"
844885746720935936,2017-03-23 12:17:13,"Kripos_NCIS",Intense redningsoppdrag for Siem Pilot denne uka. 900 levende og en død kom i dag med skipet til Sardinia @Frontex https://t.co/G7t2oaCHUU
846328353951043585,2017-03-27 11:49:38,"Kripos_NCIS",Kripos advarer: Svært farlig stoff i omløp. Flere overdosedødsfall i Norge og Sverige.   https://t.co/o8qXZsS2Yt https://t.co/2LXEAocnOE
846621115837546496,2017-03-28 07:12:58,"Kripos_NCIS",Regjeringen har tatt en beslutning om Norges videre bidrag i operasjonene i Middelhavet https://t.co/eQWM1CARBN @Frontex
848959781226283008,2017-04-03 18:05:59,"Kripos_NCIS",RT @NorCERT: Kripos advarer: – Stor økning i datakriminalitet. Oppfordrer flere til å anmelde til politiet. https://t.co/IN1JxFecaw
850278273611210753,2017-04-07 09:25:12,"Kripos_NCIS",Har du funnet bilder av deg selv på nettet som du ikke vil at andre skal se? Her er gode råd: https://t.co/ljLxEocMsg
850408196183384064,2017-04-07 18:01:28,"Kripos_NCIS",RT @Politidir: Politiet i de største byene og ved Oslo lufthavn Gardermoen har besluttet midlertidig bevæpning inntil videre. https://t.co/…
851118268274401280,2017-04-09 17:03:02,"Kripos_NCIS",RT @Politidir: Tiltak i politiet etter hendelsen i Stockholm https://t.co/90xyox67QO
853716421494394881,2017-04-16 21:07:10,"Kripos_NCIS",Siem Pilot har deltatt i syv redningsaksjoner 1. påskedag. Med 816 migranter ombord setter de i natt kursen tilbake til Italia. #frontex https://t.co/3jUsmd3WBS
854278097687937025,2017-04-18 10:19:04,"Kripos_NCIS","Jobber du i barnehage? Hvordan stille barn de rette spørsmålene om vold og overgrep. Viktig konferanse, vi deltar: https://t.co/O2O5hmtaXm"
854803875991363586,2017-04-19 21:08:20,"Kripos_NCIS",RT @kjelljohan1: Jente fikk 60 dagers betinget fengsel for å dele video fra fest. Viktig bevisstgjøring av ungdom fra politiadvokaten https…
855455834163339265,2017-04-21 16:18:59,"Kripos_NCIS",Olympic Commander tar over for Siem Pilot i Middelhavet. Stor takk til OH Meling&amp;Co for innsatsen. @Justisdep   https://t.co/BGtesFHBUn https://t.co/UIGYP8TKMW
855466603558969344,2017-04-21 17:01:46,"Kripos_NCIS",@UlvBjerkan @Justisdep @Regjeringen Vi er en del av @Frontex og underlagt italienske myndigheter. Skipet har verken myndighet eller mulighet til å gå til Libya.
855467327881695234,2017-04-21 17:04:39,"Kripos_NCIS",@UlvBjerkan @Justisdep @Regjeringen Vi driver etterretning ombord og leter etter de som kan ha vært med på å organisere overfarten. 180 mistenkte så langt. Flere lange dommer.
856469388857356288,2017-04-24 11:26:29,"Kripos_NCIS",I fjor kom 14 russ til politiet fordi de var voldtatt. I år vil vi unngå det. Ta vare på vennene dine. Sett grenser. Vær en kjernekar. https://t.co/6N94rUv8nZ
856505137640218624,2017-04-24 13:48:32,"Kripos_NCIS",Russen og Kripos sammen om Kjernekar-kampanje. https://t.co/xDNkToAJWn https://t.co/M0WThyW2no
857256479321190400,2017-04-26 15:34:06,"Kripos_NCIS",Mange vet ikke hvor grensene går. Vet du? Ta testen til NRK.   https://t.co/VegSUmd0FJ
857496908583010305,2017-04-27 07:29:29,"Kripos_NCIS","RT @Lenareif: Lurer du på noe om voldtekt og overgrep? I dag kl 17 svarer @Kripos_NCIS ""live"" på dine spørsmål https://t.co/4Q3d67tdmg"
857532402075348992,2017-04-27 09:50:31,"Kripos_NCIS",Kripos ble i morges informert om at et norsk barn er kidnappet i Nikosia. Kypriotisk politi etterforsker og vi vil bistå. (1/2)
857532680296124420,2017-04-27 09:51:37,"Kripos_NCIS","Av hensyn til det arbeidet som gjøres på Kypros, må spørsmål om etterforskningen per nå rettes til politiet på Kypros.(2/2)"
