1063362886003802112,2018-11-16 09:27:23,"Kripos_NCIS","@RitaBendiksen Hei Rita, som det står i utlysningen, så kan lang og relevant erfaring kompensere for manglende formell utdanning."
1063425294298742784,2018-11-16 13:35:22,"Kripos_NCIS","Mange ser nå fram til fine julebord og gode fester.   I fjor ble det anmeldt 580 festrelaterte voldtekter, og derfor må vi igjen be alle om å passe på hverandre. Vær en kjernekar, og pass på de rundt deg slik at de ikke havner i farlige situasjoner.   Vi ønsker alle en god fest! https://t.co/0OZU7ix48o"
1064773211441807360,2018-11-20 06:51:30,"Kripos_NCIS",Straffbart eller ei. Det er ikke greit å hetse folk på nett. Det er ikke greit å komme med stygge kommentarer. Møt Lone Pettersen og Kjersti Rønholt i episode tre av «Med Kripos på jobb».  https://t.co/5yeGO5Hq6N https://t.co/jkYGmca2FL
1065955892666032129,2018-11-23 13:11:03,"Kripos_NCIS",Kripos søker ein engasjert medarbeidar til utvikling og bruk av tekniske metodar i skjult etterforsking https://t.co/TYbgy6CnkZ
1065956424763801600,2018-11-23 13:13:10,"Kripos_NCIS",Vi søker deg som vil vere ein del av eit politi- og teknologimiljø med svært høg fagleg kompetanse https://t.co/kfPdvLMNIA
1067346672202784770,2018-11-27 09:17:31,"Kripos_NCIS",- Vår jobb er å få de tause vitnene til å fortelle hva som har skjedd med den døde.  Håvard Haftor Arntzen har jobbet som kriminaltekniker på Kripos i nesten 25 år. Hør han fortelle om arbeidet sitt i siste episode av «Med Kripos på jobb». https://t.co/CfC9YHycBw https://t.co/kh4pb95Unl
1067788720244490240,2018-11-28 14:34:04,"Kripos_NCIS","- Det finnes ingen fasit på reaksjoner etter en voldtekt.  @vgnett sin sak om Tanja Arntsen og hennes kamp har berørt mange. Vi har spilt inn en spesialepisode av «Med Kripos på jobb» om voldtekt med Emil Kofoed, leder av Voldtektsseksjonen på Kripos.  https://t.co/u8xMGvxKLA https://t.co/U8O2GIua0t"
1069899380939988995,2018-12-04 10:21:04,"Kripos_NCIS","- Det er vanskelig å løse gamle drapssaker. Vi har stor tro på at det er mulig, samtidig som vi ikke ønsker å gi de pårørende urealistiske forventinger.   @EspenErdal og Tone Aase snakker om arbeidet med uoppklarte saker i episode 5 av «Med Kripos på jobb» https://t.co/5k2NrEiL0u https://t.co/DF2TMkJvPJ"
1069962072782499840,2018-12-04 14:30:11,"Kripos_NCIS",På Kripos er det ledig ei stilling som avdelingsingeniør ved seksjon for narkotikaanalyse https://t.co/ECxWAwyZiL https://t.co/IgtVO9yYJ7
1070229816744534016,2018-12-05 08:14:06,"Kripos_NCIS",Vi skal tilsette ein etterforskar med særleg ansvar for etterforsking av seksuallovbrot mot born https://t.co/7J7a3Yrj7m https://t.co/rEfdqFh9we
1070255723890860032,2018-12-05 09:57:03,"Kripos_NCIS",Seksuelle overgrep mot barn skjer oftere enn du liker å tro. Ofte forblir overgrepene en hemmelighet. Er du selv utsatt eller mistenker du at noen utsettes for overgrep må du si ifra til politiet. #ikkehemmelig  https://t.co/SHno4s6YMk https://t.co/F5vEfWapiF
1070601094340976640,2018-12-06 08:49:26,"Kripos_NCIS",RT @NOVAnytt: Laila Søndrol: antallet tips om seksuelle overgrep på nett som Kripos får inn har over doblet seg på et år  - fra 5300 i 2017…
1072483327255502848,2018-12-11 13:28:45,"Kripos_NCIS","Er det noe som fortsatt sjokkerer en etterforsker som har jobbet med vold mot barn i 20 år? Spørsmålet stilles i denne ukens episode av podcasten Med Kripos på jobb, der Kåre Svang er gjest.   Episoden finner du her: https://t.co/XIRn4vb53t https://t.co/970ugWNJAp"
1074242160738869249,2018-12-16 09:57:44,"Kripos_NCIS","Flere politidistrikt melder om svindelmailer i dag. Her hevder avsender å ha tatt kontroll over kameraet på maskinen, og filmet mens brukeren ser på pornografi. Politiet oppfordrer alle til å slette slike e-poster og ikke tenke noe mer over det. https://t.co/yCNSPCnEBM"
1075734001887965184,2018-12-20 12:45:46,"Kripos_NCIS",Har du tips om Marokko-saken ønsker politiet at du bruker https://t.co/KDCnqwOCIa - trykk på «tips aktuelle straffesaker».  Her er siste oppdatering i saken: https://t.co/9jzsTFs67p
1075736981777276928,2018-12-20 12:57:37,"Kripos_NCIS","Two women, a Danish and a Norwegian citizen, have been found murdered in Morocco. If you have any information regarding the killings, please contact NCIS Norway: https://t.co/JgISV3a954"
1076034619332542464,2018-12-21 08:40:19,"Kripos_NCIS",https://t.co/lo2sxXGbkT
1078259113325461505,2018-12-27 11:59:40,"Kripos_NCIS",Kripos har to ledige stillingar som skal jobbe førebyggande mot radikalisering og valdelig ekstremisme på internett.   https://t.co/SSHYaIlXjy https://t.co/1Rr8gw9CyG
948584323258769408,2018-01-03 15:58:21,"Kripos_NCIS",Sicilia: Direktøren for operasjoner i @Frontex takker mannskap på det norske skipet i Operasjon Triton. Skipet har nå hatt sitt siste grenseoppdrag i Middelhavet. https://t.co/H8KyZt8gLM
948589889871863808,2018-01-03 16:20:28,"Kripos_NCIS","Sicilia: Avslutningsseremoni for den norske skipet i Operasjon Triton i kveld. Med @Politidir, Sjef Kripos og Sjef Kytsvakten, @frontex og italienske myndigheter. Et to og halvt år langt oppdrag med grensekontroll og redning er over. https://t.co/g9DQf3zJkS"
948866655446339584,2018-01-04 10:40:14,"Kripos_NCIS",Olympic commander forlater nå Italia. Den norske bidraget i Operasjon Triton er avsluttet https://t.co/5RvKBSZs4j https://t.co/L8dXNtLiIN
949609081043652608,2018-01-06 11:50:22,"Kripos_NCIS",RT @kjelljohan1: «Privat» etterforskning dukker stadig oftere opp - og det er en farlig trend. Hører for all del ikke hjemme i en rettsstat…
950671109942317056,2018-01-09 10:10:29,"Kripos_NCIS","Politioverbetjent Kristian Tangen om å avhøre barn.  «Vet du hva, dette føles helt forferdelig å høre på, men denne skal jeg ta. Jeg skal ta en for laget, jeg skal ta en for deg». Og med laget mener jeg oss som samfunn.  https://t.co/oHU2eZbEbH"
951862722878156801,2018-01-12 17:05:32,"Kripos_NCIS",Vil du jobbe med HR i Kripos? Søknadsfrist 14.1 https://t.co/eseYHBjGp9
955503364472745989,2018-01-22 18:12:09,"Kripos_NCIS",Kripos søker seksjonsleder til kriminalteknisk avdeling https://t.co/G578KB4h15
955550912629694464,2018-01-22 21:21:05,"Kripos_NCIS",Så bra at dere tar kampanjen videre. Og takk for viktig arbeid! https://t.co/pGj786HI6U
956080174956777472,2018-01-24 08:24:11,"Kripos_NCIS","Når det skjer et drap, setter vi inn alt vi kan av ressurser. Det er svært viktig for de pårørende og for samfunnet at disse sakene løses. I 2017 skjedde det 25 drap og det er tatt ut siktelser i alle sakene. https://t.co/5olRxuZoUh"
956176049196462087,2018-01-24 14:45:09,"Kripos_NCIS","Det begås få drap i Norge. Vi er likevel bekymret for andelen partnerdrap. Leder for Voldsseksjonen på Kripos, Vibeke Schei Syversen https://t.co/1FhtdyyNq7. https://t.co/5cD5M2WNWG"
956255675843215360,2018-01-24 20:01:34,"Kripos_NCIS","@DagWivelstad Fra den vedlagte rapporten kan man finne en del kjennetegn ved drapene, som drapsvåpen og alder på gjerningsperson. Ved partnerdrap vet vi at det ofte har vært et forhold preget av vold."
956797884451753984,2018-01-26 07:56:06,"Kripos_NCIS",Vi vil gjøre enda mer for å bekjempe vold og overgrep mot barn. Flere ledige stillinger https://t.co/7KfsO4J2xo https://t.co/jZz4XmfyWZ
958348997894311936,2018-01-30 14:39:41,"Kripos_NCIS","Kripos-etterforsker Kristian Tangen reiser landet rundt, og noen ganger utenlands, for å avhøre barn som er utsatt for overgrep. Han frontet kampanjen #ikkehemmelig og brenner for jobben sin👮🏼‍♂️ https://t.co/HhyRFjIOMA"
959750135306702849,2018-02-03 11:27:18,"Kripos_NCIS",RT @INTERPOL_HQ: Why do we work on victim identification? Because photographs &amp; films depicting #childsexualabuse are not merely an online…
960147797080145922,2018-02-04 13:47:28,"Kripos_NCIS",Politiet tar nå flere som sprer intime og ydmykende bilder eller filmer av andre. Hjelp oss med å spre budskapet om at dette er ulovlig og får konsekvenser https://t.co/jZjxm17k27
960464645977976834,2018-02-05 10:46:30,"Kripos_NCIS",RT @DSB_no: Det nye cyberkoordineringssenteret som kom i fjor og et nytt cyberkrimsenter skal gi god samordning og økt trygghet i det digit…
960809275688972289,2018-02-06 09:35:56,"Kripos_NCIS",Lihkku beivviin👩‍✈️👨‍✈️ https://t.co/46aPtE4LVF
960902080272613376,2018-02-06 15:44:43,"Kripos_NCIS","Takk for besøket, Sylvi Listhaug @Justisdep. Glade for å få fortelle om hvordan vi jobber sammen med politidistriktene, andre etater og politi i andre land. Her på seksjon for seksuallovbrudd med @sondrolsen. https://t.co/Hu4qVC9YQy"
960983651449229313,2018-02-06 21:08:51,"Kripos_NCIS",RT @eJenss: Flere dømmes nå for å dele nakenbilder av andre https://t.co/6n1XAHPtJI
961544659465056256,2018-02-08 10:18:06,"Kripos_NCIS",Ny rapport om menneskehandel i Norge. Politiet trenger mer informasjon for å kunne avdekke flere saker https://t.co/ikQGeIvRWL
961887508958187520,2018-02-09 09:00:27,"Kripos_NCIS",Fire ledige stillinger som politiadvokat på Kripos https://t.co/kSX0V1a3R7 https://t.co/wlUJc20Tbc
961906388686454785,2018-02-09 10:15:29,"Kripos_NCIS",Narkotikastatistikk for 2017: MDMA-beslag tredoblet på fire år.   https://t.co/yWA6k7eRGN https://t.co/5cO5Bh5caT
966645398642323456,2018-02-22 12:06:37,"Kripos_NCIS",RT @Barneombudet: Her finner du vår rapport om seksuelle krenkelser blant unge: https://t.co/JornpPzpMY
966649088916811777,2018-02-22 12:21:16,"Kripos_NCIS",Vil du bidra til at Norge ikke blir en frihavn for krigsforbrytere? Vi søker ny medarbeider som kan arabisk https://t.co/INtEKiYpf6 https://t.co/MoUXLY3EzA
967079814598479877,2018-02-23 16:52:49,"Kripos_NCIS",RT @Europol: Help us #StopChildAbuse! These park and beach resort are featured in child abuse material. Do you know where they are? This in…
968473038269411329,2018-02-27 13:09:00,"Kripos_NCIS",Kripos har ledig en fast stilling som medierådgiver. https://t.co/U1EqH607MH https://t.co/DIulgToZd7
968830268500037633,2018-02-28 12:48:30,"Kripos_NCIS","Straffeloven er nå oversatt til engelsk, med bidrag fra språkseksjonen på Kripos https://t.co/Hr8BhLvtYi"
969836903959810049,2018-03-03 07:28:31,"Kripos_NCIS","RT @Medietilsynet: Barn og medier og seksualitet: velkommen til frokostmøte 13. mars - med @Medietilsynet, @Barneombudet og @Kripos_NCIS: N…"
970540524242456576,2018-03-05 06:04:27,"Kripos_NCIS",Operasjon Malstrøm: Kripos har siden høsten 2017 etterforsket en rekke saker der unge menn har blitt utsatt for seksuell utpressing etter å hatt kontakt med personer på videochat.  https://t.co/dhJKFIvs6y
970580944930377729,2018-03-05 08:45:04,"Kripos_NCIS",Vi råder alle om å være forsiktige når man er på chattetjenester med ukjente. Ikke alle er den de utgir seg for å være. https://t.co/67m8GKqE12
970952956207157248,2018-03-06 09:23:18,"Kripos_NCIS",Følg foredraget til sjef Kripos Ketil Haukaas om utviklingen i overgrep mot og mellom ungdom her fra 10.25: https://t.co/g615F8dllO https://t.co/VBhI3IKNc6
970959049578700800,2018-03-06 09:47:31,"Kripos_NCIS",Vi må slutte å bruke begrepet hevnporno om ulovlig deling av nakenbilder. Det har ingen ting med hevn å gjøre. Vi kaller det ikke et hevnslag når en forsmådd ekskjæreste slår.   - Ketil Haukaas https://t.co/tAqT0TId9z
970959277027397632,2018-03-06 09:48:25,"Kripos_NCIS","RT @Barneombudet: Klar tale fra Ketil Haukaas @Kripos_NCIS - blir du truet til å dele nakenbilder eller opplever det, så anmeld det. ""Vi må…"
971300390636531713,2018-03-07 08:23:53,"Kripos_NCIS","Etter 30 år i politiet har jeg sett mange saker der barn er utsatt for overgrep. Og er det en gjennomgående ting som har frustrert meg, så er det alle voksne rundt som visste eller burde ha visst. Ta kontakt med politiet ved mistanke.   - Sjef Kripos, Ketil Haukaas. https://t.co/d9I15ZZV2Y"
971733293535301632,2018-03-08 13:04:05,"Kripos_NCIS",Kommunikasjonssjef i Kripos @IdaDahl snakker om kampanjen «Hvor lite skal du finne deg i?» på Nordisk konferanse om vold mot kvinner. Alle har rett til et liv uten frykt for vold. Søk hjelp tidlig. Sjekk https://t.co/lftU8hY90j https://t.co/yHyJVDBJ7O
972081694881787904,2018-03-09 12:08:31,"Kripos_NCIS",Nordmenn som bestiller direkteoverførte seksuelle overgrep av barn skal ikke føle seg trygge. De skal stilles til ansvar. https://t.co/3TXeElq8Od
972810886250483712,2018-03-11 12:26:03,"Kripos_NCIS",Kripos har ledig jobb som medierådgivar. Søknadsfristen er om ei veke. https://t.co/sL51U5pLe6
973463951936761856,2018-03-13 07:41:06,"Kripos_NCIS",Politioverbetjent Bjørn-Erik Ludvigsen fra Kripos snakker om konsekvensene av ulovlig deling av nakenbilder fra 09:10. https://t.co/xWcdKmEJet
973488869831299072,2018-03-13 09:20:07,"Kripos_NCIS","- Ungdom og voksne må lære seg at norsk lov også gjelder på internett. Å sende dick pics uppfordret er etter loven det samme som som å hoppe ut av busken og blotte seg.   Bjørn-Erik Ludvigsen, Kripos https://t.co/AwR1Atwrow"
973514487411216384,2018-03-13 11:01:55,"Kripos_NCIS",@BetConsultant @anineki Loven er lik for alle.
974926037674053632,2018-03-17 08:30:55,"Kripos_NCIS",Kripos set i år opp eit nasjonalt cyberkrimsenter. No er stillinga som leiar lyst ut https://t.co/Rm0jWAuv0H https://t.co/hKTuVfprx3
975388036287655936,2018-03-18 15:06:44,"Kripos_NCIS",Det er viktig at både foreldre og barn forstår at en del av disse innleggene er straffbare og kan få store konsekvenser for dem.  https://t.co/Ci8CfhXraV
976453002142855168,2018-03-21 13:38:31,"Kripos_NCIS",Søknadsfrist 4.april https://t.co/Rm0jWAuv0H https://t.co/2Q3903FvEf
976851910031536132,2018-03-22 16:03:39,"Kripos_NCIS",I dag får mannskap som deltok i Operasjon Triton i Middelhavet politiets medalje for internasjonal tjeneste. De har drevet grensekontroll ved Schengens yttergrense og de har reddet liv. https://t.co/CeS2dCgCC2
977441590175256576,2018-03-24 07:06:49,"Kripos_NCIS",Norsk mann i 60-åra vart før helga pågripen og sikta for direkteoverførte overgrep https://t.co/OgeT8ro6JR
977481874506440705,2018-03-24 09:46:54,"Kripos_NCIS",Sør-Trøndelag tingrett har avgjort at mannen vert varetektsfengsla i fire veker. https://t.co/6zvDwsNFRe
981948242408689664,2018-04-05 17:34:39,"Kripos_NCIS",Kripos styrker innsatsen mot datakriminalitet  https://t.co/bxp1geNcgI
982218189479206912,2018-04-06 11:27:19,"Kripos_NCIS",Aksjon i @politifinnmark mot nedlasting av overgrepsmateriale. To er i varetekt siktet for pågående overgrep. https://t.co/2qQVqirAj6
984093015097724928,2018-04-11 15:37:13,"Kripos_NCIS",RT @okokrim: ØKOKRIM bekrefter bistandssak:  https://t.co/q8st5MUOTc #økokrim
984144308642177025,2018-04-11 19:01:02,"Kripos_NCIS",Vi forbereder oss til russetid sammen med RusseID. Også i år gjelder det å være en kjernekar og passe på at alle får en fin feiring. https://t.co/nl0rXFYEvr
984674228095082496,2018-04-13 06:06:44,"Kripos_NCIS",Offentlig søkerliste til stillingen som leder for Nasjonalt cyberkrimsenter https://t.co/hvmeGJXDe3
984733801036308480,2018-04-13 10:03:28,"Kripos_NCIS",Denne uken arrangerte Kriminalteknisk forum i samarbeid med Kripos årets Kriminaltekniske landskonferanse. https://t.co/k8FChTXrlH
985432734532341761,2018-04-15 08:20:47,"Kripos_NCIS",Seksjon for datakriminalitet etterforskar alvorleg datakriminalitet og hjelper politidistrikta og utanlandsk politi med slik etterforsking. Seksjonen har fleire ledige stillingar: https://t.co/bxp1geNcgI
986126733878407169,2018-04-17 06:18:29,"Kripos_NCIS",Vi er på Internett for å forebygge og avverge alvorlig kriminalitet. Her er et godt eksempel på hvordan @politiinnlandet raskt fulgte opp en trussel på Facebook https://t.co/R05rXCiROz
986244175577395200,2018-04-17 14:05:09,"Kripos_NCIS",Stas med besøk fra @Justisdep og statsråd Tor Mikkel Wara. Her på vår seksjon for elektroniske spor. https://t.co/VGgdOkd6mi
986601669050978305,2018-04-18 13:45:42,"Kripos_NCIS",Norge er nå opptatt som fullverdig medlem i Joint Cybercrime Action Taskforce. Norsk liason på plass hos @EC3Europol fra høsten https://t.co/3LQP2zmmff
986620054367293440,2018-04-18 14:58:46,"Kripos_NCIS",RT @Europol: Velkommen Norway &amp; Wilkommen Switzerland! 2 new countries join the Joint Cybercrime Action Taskforce (J-CAT) under new Chairma…
986963271738675200,2018-04-19 13:42:35,"Kripos_NCIS",Vil du vere med å førebyggje og avverje kriminalitet på Internett? Kripos har ledig ei stilling som politibetjent https://t.co/hLc9FMKS3A
988445729030131717,2018-04-23 15:53:20,"Kripos_NCIS","@mrkhoel @StormJL Vi har svært mange erfarne medarbeidere, men har sett at vi ofte får til mye godt når ganske nyutdannete får jobbe i team med mer erfarne."
988446515436847104,2018-04-23 15:56:28,"Kripos_NCIS",Vi er både åpent og skjult tilstede på internett. Dette er en jobb for deg som ønsker å jobbe med skjulte metoder https://t.co/aOtihZAmrN
988646440858783745,2018-04-24 05:10:54,"Kripos_NCIS",Under russetiden i fjor ble det anmeldt 16 voldtekter. I fem av sakene var det personer tilstede som observerte voldtekten uten å gripe inn. Alle har en plikt til å følge med og si ifra. Vær en kjernekar.   https://t.co/24qXkm5F3d https://t.co/2o3jXcFUuK
989039273935605763,2018-04-25 07:11:53,"Kripos_NCIS","Operasjon Zalo: Vi har brukt alle typer virkemidler og verktøy for å avdekke summen av kriminaliteten de bedriver.  Tverretatlig etterforskning gir resultater (@okokrim, @NAVnorge, @Skattenmin og @Utlendingsenhet).  https://t.co/7dR0jUEO2l"
989459110931378177,2018-04-26 11:00:09,"Kripos_NCIS",Pressekonferanse sammen med politimesteren i @politietsorvest i forbindelse med at Cold case-enheten på Kripos har gjennomgått Tina Jørgensen-saken. https://t.co/6TM0FluEGl
989854946228043776,2018-04-27 13:13:04,"Kripos_NCIS",Ha ei fin helg! Hugs at ein kjernekar er ein som passar på venene sine. https://t.co/AVbMnGRqUL
991771405460082688,2018-05-02 20:08:23,"Kripos_NCIS",Norsk politi skal sende ein ny liason til Interpol sitt cyber- og innovasjonssenter i Singapore.  https://t.co/v0CcwF7ba2
992829058818945025,2018-05-05 18:11:08,"Kripos_NCIS",Her er det bare å gratulere @okokrim ! Dere er rå. https://t.co/TCv5QK7apZ
993465144775708672,2018-05-07 12:18:42,"Kripos_NCIS",Eg er ein kjernekar. https://t.co/xzgf0BEb9K
993490648333455360,2018-05-07 14:00:03,"Kripos_NCIS","Vi har besøk fra finske kolleger. Mye å lære av hverandre, ikke minst når det gjelder forebygging og bekjempelse av cyberkrim. NBI, tervetuloa Kriposin. https://t.co/7PRunNQChg"
993771388417822720,2018-05-08 08:35:37,"Kripos_NCIS",Gratulerer med dagen veteraner!  📸 Politi og forsvar side om side i Middelhavet. https://t.co/CUTAXpgTkT
995984600819290112,2018-05-14 11:10:07,"Kripos_NCIS",RT @UN__Cyber: On Monday @UNODC we’ll have a Special Event @CCPCJ #CCPCJ27 Crime Commission.  Come and join us in Boardroom A in M Building…
996000171665383425,2018-05-14 12:12:00,"Kripos_NCIS",RT @NorwayinVienna: Special event with our Deputy Minister of Justice now on #prevention of online child abuse through #innovative approach…
998925050001743873,2018-05-22 13:54:25,"Kripos_NCIS",Vi søker etterforskingsleder i kampen mot vold og seksuallovbrudd mot barn https://t.co/C0tuoYmucm
999547867349078017,2018-05-24 07:09:16,"Kripos_NCIS",I to og et halvt år jobbet politi og @Forsvaret_no sammen i Operasjon Triton. I dag presenteres det norske bidraget på @Frontex EBCG-day i Sopot. Over 35 000 mennesker ble reddet av to norske skip fra 2015-2017. @kystvakten https://t.co/BKVEPi4tn2
1080388343098232832,2019-01-02 09:00:28,"Kripos_NCIS",Kripos har ei ledig fast stilling og eit vikariat som politiførstebetjent/politioverbetjent ved Seksjon for Interpol og Europol https://t.co/lKXK45JQDm
1080413129425780736,2019-01-02 10:38:57,"Kripos_NCIS",Søknadsfrist 4.januar: Kripos har ei ledig fast stilling som etterforskar av saker som gjeld organisert kriminalitet https://t.co/fvFpqrdcep
1080736255170826242,2019-01-03 08:02:56,"Kripos_NCIS","Vi har alle et ansvar for å stoppe vold og melde fra om vold mot barn. Er du i kontakt med barn, er det viktig at du lærer deg å se etter tegn på vold og mishandling. Lær deg de røde varselflaggene🚩 https://t.co/4MZmytOWrR"
1082918815409848320,2019-01-09 08:35:39,"Kripos_NCIS",RT @politietost: Politiet informerer om antatt bortføring på Romerike i dag kl 11: https://t.co/Hteszvf6m3
1082945479485411328,2019-01-09 10:21:37,"Kripos_NCIS",Tips i sak @politietost om den savnede Anne-Elisabeth Hagen https://t.co/MIpKzsKIV4 evt tlf. 64819599. https://t.co/xgRsmZBDKl https://t.co/sSka8dK23Q
1083672324061233153,2019-01-11 10:29:50,"Kripos_NCIS","RT @Politiforum: Hvis det skjer en større ulykke eller terrorangrep på Island, skal den nasjonale ID-gruppa hos @Kripos_NCIS bistå i identi…"
1085421715813994498,2019-01-16 06:21:17,"Kripos_NCIS","Det var 24 drapssaker i fjor, med 25 ofre og 26 gjerningspersoner. Her er drapsoversikten for 2018: https://t.co/wXsajJ7mQK"
1086247723156848640,2019-01-18 13:03:33,"Kripos_NCIS",En dommer ved Oslo tingrett er siktet for overtredelse av straffeloven § 311 første ledd: https://t.co/iNyphSncmf
1087056180856475651,2019-01-20 18:36:04,"Kripos_NCIS",Ny stilling som leiar for seksjon for påtale på Kripos: https://t.co/lcGoZB0qrs
1087303307759181824,2019-01-21 10:58:04,"Kripos_NCIS",Vi søker etter leiar til vår seksjon for personvern: https://t.co/cyv4To4nZl
1088374674881433600,2019-01-24 09:55:18,"Kripos_NCIS",Fredag 25. januar er det offisiell åpning av Najonalt cyberkrimsenter (NC3) ved Kripos: https://t.co/XvTc5rYvg0
1088764223105236992,2019-01-25 11:43:13,"Kripos_NCIS","Justis- og innvandringsminister Tor Mikkel Wara åpner Nasjonalt Cyberkrimsenter (NC3) på Kripos. Gjennom å forebygge, avdekke og etterforske trusler og kriminalitet skal cyberkrimsenteret bidra til å skape økt trygghet i det digitale rom. https://t.co/zMlX3HAoQ7"
1088809780045582338,2019-01-25 14:44:15,"Kripos_NCIS",NC3 på Kripos skal bli en spydspiss for politiet i bekjempelsen av kriminalitet og trusler i det digitale rom https://t.co/VI9RYiVLyV https://t.co/qvTKwZzzh4
1089773420483616768,2019-01-28 06:33:25,"Kripos_NCIS","Det er lett å miste kontrollen over et bilde som er delt.  Kripos lanserer ""Delbart?"", et undervisningsopplegg til ungdomsskoleelever for å forebygge deling av seksualiserte bilder og videoer. https://t.co/6A93i0LzDt https://t.co/KGwMWosI5r"
1089822399091097600,2019-01-28 09:48:02,"Kripos_NCIS","Renate, Tone og Hanne fra Kripos skal de neste månedene besøke ungdomsskolelever og deres foreldre over hele landet. Satsningen heter «Delbart?», og skal gi ungdommer kunnskap til å ta gode valg for seg selv og andre.  https://t.co/6A93i0LzDt https://t.co/Xf9j4DVOal"
1089843673192431617,2019-01-28 11:12:34,"Kripos_NCIS","@mamachevy37 Enig. Akkurat dette opplegget er skreddersydd for ungdomsskolen, men nettvett må man begynne med mye tidligere."
1090232895342555137,2019-01-29 12:59:12,"Kripos_NCIS",Europol har i samarbeid med nederlandsk og engelsk politi tatt ned en stor markedsplass for kjøp av tjenestenektangrep (DDoS). Kripos har mottatt informasjon om flere norske brukere som skal ha kjøpt tjenester og angrepet ulike mål.  https://t.co/m1yAH5MrVu https://t.co/gY2UQPnS8j
1090572028351000576,2019-01-30 11:26:48,"Kripos_NCIS",«Delbart»-permiere på Sandgotna skole i Bergen for hele 9. trinn og forebyggere fra @politivest. https://t.co/M4GHM2TNXY
1090609521851011073,2019-01-30 13:55:47,"Kripos_NCIS","I dag ble regjeringens nasjonale strategi for digital sikkerhet lansert. Sjef Kripos, Ketil Haukaas, hadde i den anledning et innlegg om vår nyeste avdeling, NC3. Avdelingen er en del av satsingen på digital sikkerhet, og skal i løpet av tre år gå fra 80 til 200 ansatte. https://t.co/VdBXbmGNRL"
1090679183322304514,2019-01-30 18:32:35,"Kripos_NCIS",Foreldremøte i Bergen om #delbart i kveld. Også voksne må vite hva loven sier om bildedeling og hvordan vi tar vare på en ungdom som har havnet i trøbbel. https://t.co/yf4lk8LvUG
1091282674281603072,2019-02-01 10:30:39,"Kripos_NCIS",RT @Europol: JOIN THE FIGHT! 19 new objects featured in CHILD SEXUAL ABUSE images published today on https://t.co/Lu7oYs6j40 Do you recogni…
1091307118534279168,2019-02-01 12:07:47,"Kripos_NCIS","I dag er Kripos 60 år.   1. februar 1959 ble Kriminalpolitisentralen opprettet med politilaboratorium, fingeravtrykk– og kriminalregister. Da var vi 34 ansatte.   I dag er vi 570 ansatte. Bistand til politidistriktene er fortsatt vår viktigste jobb. https://t.co/tNN3audxWv"
1091696387098624001,2019-02-02 13:54:36,"Kripos_NCIS",Vi har ei ledig stilling til deg som har politiutdanning og kan jobbe med teknisk og taktisk spaning https://t.co/Df8kqBasM1
1091986294366965761,2019-02-03 09:06:35,"Kripos_NCIS","Op Zalo: På én dag i 2015 ble 21 personer pågrepet i en av de største bedragerisakene i norgeshistorien. Tiltalene fortsetter å komme fire år etter. Bra samarbeid med @okokrim, NAV og Skatt Øst.   https://t.co/3rvu2opfMe"
1092415134469967872,2019-02-04 13:30:38,"Kripos_NCIS","Vi har ei fast stilling som etterforskar i seksjonen som jobbar med krigsbrotsverk, folkemord og brotsverk mot menneskeætta. https://t.co/7NcdAwAQ6m https://t.co/FbHL9n4IwT"
1092780591345487874,2019-02-05 13:42:50,"Kripos_NCIS",RT @KjellOMoen: @Kripos_NCIS presenterer Delbart? ved Molde politistasjon. Egne ansatte og samarbeidsrelasjoner. https://t.co/pDfODi8O29
1093116672213426176,2019-02-06 11:58:18,"Kripos_NCIS","Lea go Juogehahtti? – lobihis govvajuohkima birra nuoraid gaskkas.   Lea rievtti mielde ráŋggáštusvuloš VÁLDIT, VURKKODIT dahje JUOHKIT álásgovaid dahje filmmaid soapmásis gii lea vuollil 18 jagi.  «Delbart?» er oversatt til nordsamisk, lulesamisk og nordsamisk.  Lihkku beivviin! https://t.co/uGGiPabIMr"
1093131313270407168,2019-02-06 12:56:29,"Kripos_NCIS","* nordsamisk, lulesamisk og sørsamisk."
