397265248207396864,2013-11-04 07:33:10,"Politihogskolen","Ynskjer du bli politi? Les om ein spanande kvardag, til ei ung politikvinne frå Oslo. http://t.co/Q4uQEgBPF7"
397333833088917504,2013-11-04 12:05:42,"Politihogskolen",Polithøgskulen gratulerar Helene Ingebrigtsen Gundhus. Første kvinnelege professor ved Politihøgskulen. http://t.co/OfF6qBXky0
398053526867173376,2013-11-06 11:45:31,"Politihogskolen",På @Politihogskolen trener studentane så hardt - at til og med øvingsdukka må ha ein pause. http://t.co/2Ws5TvLrB0
398392854650699776,2013-11-07 10:13:52,"Politihogskolen","Ang studenter, fremskutt lagring, IP-status og våpen ved utrykning må vi henvise til POD, og PDs håndtering. http://t.co/3w6ao5zEcp"
398392960531701761,2013-11-07 10:14:18,"Politihogskolen",@SFSolheim @thomastveit @AStromsather Se svar i egen tweet.
398397347551379457,2013-11-07 10:31:44,"Politihogskolen",Tør du gå bart mot bart? Politistudentane utfordrar lærarene sine og politimesterane til barte-duell. http://t.co/jD791usg95 #movember
398426610191187968,2013-11-07 12:28:00,"Politihogskolen","@thomastveit Lenken er direktivet. Studenter i praksis har ikke IP-godkjennelse. Videre spørsmål ref IP-status, ta kontakt med @Politidir"
398825498651807744,2013-11-08 14:53:03,"Politihogskolen",7 av 10 nyutdanna politistudentar med vitnemål er no i jobb i etaten. http://t.co/fzI1RhwSat
400188128217927680,2013-11-12 09:07:39,"Politihogskolen",Politihøgskolen har offentleggjort evaluering frå Øvelse Gemini 2013 i Nordmøre og Romsdal politidistrikt.  http://t.co/lqmBbYfo7o
402332306427244547,2013-11-18 07:07:51,"Politihogskolen","Støtt kampanja frå Kripos, følg med og vær ein #kjernekar ! http://t.co/pXgzen6JRu"
402705336059957248,2013-11-19 07:50:08,"Politihogskolen",Ny kronikk frå @HoelLinda og Oddbjorg Edvardsen ved @Politihogskolen  http://t.co/s5UjPNLaLG #tenkesjølv #debattomutdanningen
402760611466997761,2013-11-19 11:29:47,"Politihogskolen","Kva er ein kjernekar? Og, er det han vi må lite på? Ny blogg frå rektor PHS, Håkon Skulstad. #kjernekar. http://t.co/BPSVgyxgSW"
402783759851724802,2013-11-19 13:01:46,"Politihogskolen",RT @IdaDahl: Kjernekar-kampanjen dag 6: Les bloggen fra rektor ved @Politihogskolen http://t.co/H6mbl81orp
403090870372536321,2013-11-20 09:22:07,"Politihogskolen",Kommunane i Vestfold er samla til klimakonferanse hos PHS i Stavern. Er dei godt nok førebudd på ekstremvær? http://t.co/RCmmgMRSh3
403109539253202944,2013-11-20 10:36:18,"Politihogskolen",Retorikken om responstid og et robust politi. Professor Tor-Geir Myhrer ved PHS med kronikk på nyemeninger.no  http://t.co/s4Otq9kerT
404965754132369408,2013-11-25 13:32:14,"Politihogskolen",@ThomasHebo @sistemann_ @Kristin_HK @JohnnyBrenna Nå kommer svar fra @Politihogskolen - i flere tweets.
404966085029425153,2013-11-25 13:33:33,"Politihogskolen",Svar fra @Politihogskolen ref absolutte høydekrav ved opptak. Svar kommer i fire tweets.
404966297697411072,2013-11-25 13:34:23,"Politihogskolen","Høydekrav 1/4: Startet med klage til Sivilombudsmannen i 2001. PHS tok til etterretning, gradvis endring, absolutt høydekrav opphevet."
404966449044672512,2013-11-25 13:35:00,"Politihogskolen","Høydekrav 2/4: 2013, ingen formelle krav til høyde. Vurdering PHS: synet på hva som kreves for å oppnå autoritet/oppgaveløsning endret."
404966553914843139,2013-11-25 13:35:25,"Politihogskolen",Høydekrav 3/4: Før fysisk styrke - nå flere former for tilnærming. PHS advarer mot synsing. Ikke belegg for å hevde at opphevelse av...
404966630456713216,2013-11-25 13:35:43,"Politihogskolen",Høydekrav 4/4: .. høydekrav har medført mer el. mindre vold mot politiet.
404972981127888896,2013-11-25 14:00:57,"Politihogskolen",Politihøgskolen må ha balanse i utdanninga. http://t.co/NaI0Ax1AOu
405979694761144321,2013-11-28 08:41:16,"Politihogskolen",Sjef-PHS Skulstad tok vel i mot Justis- og beredskapsministeren da Anundsen åpna Radikaliseringskonferansen 2013. http://t.co/xPfnVuAwa4
406011198711144448,2013-11-28 10:46:27,"Politihogskolen",Bidra til ny handlingsplan mot radikalisering voldelig ekstremisme.http://t.co/p7dlJ9KAJi @Justisdep
407411080814542848,2013-12-02 07:29:05,"Politihogskolen",Årlege stabskurs frå PHS - stabskurs på nett og i distrikt. http://t.co/c1Y4mrzNx5
408173808600612866,2013-12-04 09:59:54,"Politihogskolen",Mindre rus og krim. Aldri har ungdom vært bedre enn nå. Lektor Elisabeth Myhre Lie ved PHS nyanserer bildet.  http://t.co/M0Hm4X7zPT
408211264465166336,2013-12-04 12:28:44,"Politihogskolen","Nærare 200 har i 2013 fått opplæring som UEH-mannskap. Talet som har godkjenning aukar, og opptrappinga held fram.  http://t.co/xssVdpYOcf"
410035444144173056,2013-12-09 13:17:22,"Politihogskolen","RT @PHSbib: All we want for christmas er 35 nye følgere! Da runder vi 1000 og får marsipankake http://t.co/jPWf1gjpcg PS Julenissen, vi har…"
410355356959649792,2013-12-10 10:28:35,"Politihogskolen",Delta-sjef Snortheimsmoen starter i ny jobb  på Politihøgskolen.  http://t.co/IDbOlinJ8F
410383522612797440,2013-12-10 12:20:31,"Politihogskolen",Politi på patrulje jaktar risiko. Doktorgrad med ny kunnskap om tenesta. Politihøgskolen gratulerer @Kristin_HK  http://t.co/5un7MWmE4g
411095887452983296,2013-12-12 11:31:12,"Politihogskolen",Vil ha meir kunnskap om samarbeid mellom forsvar og politi. Forskarane førebur nytt prosjekt. http://t.co/17J06BuwGk
411100032214237184,2013-12-12 11:47:40,"Politihogskolen",RT @Politidir: Justis- og beredskapsdepartementet har konstituert fire politimestre: http://t.co/yaZmJve8Nq
411100339832913920,2013-12-12 11:48:53,"Politihogskolen",RT @EllenKatrineH: @Politihogskolen Bra! Se gjerne nord og øst! @Forsvaret_FOH @Forsvaret_no
411131777244090368,2013-12-12 13:53:48,"Politihogskolen",Politiutdanning i utvikling. Her er programmet for  Politihøgskolen sin utdanningskonferanse i januar 2014. http://t.co/6Db3a5Alwt
411140438054039552,2013-12-12 14:28:13,"Politihogskolen","Takk for i år - og kjør debatt! Sjef PHS Håkon Skulstad med ny blogg, om utdanning og ein frisk start i 2014.  http://t.co/6EaQw5VN8T"
411434330443882496,2013-12-13 09:56:03,"Politihogskolen",Høyringssvar om handlingsplan mot økonomisk kriminalitet: Vil ha studie på høgskolenivå i regi av PHS.   http://t.co/WErbfHS30U
412532383116587008,2013-12-16 10:39:19,"Politihogskolen",Foran opptaket i 2014 justerer PHS de fysiske testene som søkerne må bestå for å komme inn på bachelorutdanningen.http://t.co/RRLQmWneJ5
412908052082196480,2013-12-17 11:32:05,"Politihogskolen",Tema Etterforsking i Magasinet Norsk Politi. Dobling av talet som tek vidare utdanning på Politihøgskolen. http://t.co/oiUGYbR57g
412933776994762753,2013-12-17 13:14:19,"Politihogskolen","RT @PHSbib: Vi oppsummerer året i PIA: 25 000 besøk i år, en dobling fra i fjor. Hva er mest lest i 2013? Se Topp 10-lista: http://t.co/9NW…"
413990094651916288,2013-12-20 11:11:44,"Politihogskolen","Ungdom nå til dags - mye bedre enn før! Mindre rus og krim, men mytene lever. Innlegg av Elisabeth Myhre Lie, PHS.  http://t.co/tlxcklVMhz"
414003254335242241,2013-12-20 12:04:02,"Politihogskolen",Nytt øvingsanlegg for operativ trening åpnet på Kongsvinger. Vi snakker om Låvens lange arm... http://t.co/HbGlZ1m7td
415064837656301568,2013-12-23 10:22:23,"Politihogskolen",Politihøgskolen sender ønske om God Jul og Godt Nytt År til alle som er med oss på twitter og i øvrige kanaler. Fortsett med det!
419001706668912640,2014-01-03 07:06:06,"Politihogskolen",RT @huspus: Lærer på @Politihogskolen og  sykehusklovn på fritiden. Stolt av kollega Tor Gustav: http://t.co/CIBKuskmnJ
419062760488435713,2014-01-03 11:08:42,"Politihogskolen","""Politiet må endre seg."" Les portrettintervjuet med sjef-PHS i @Politilederen. http://t.co/K7UktQapYI"
420444860848406528,2014-01-07 06:40:40,"Politihogskolen","@Politihogskolen jakter, med ny kampanje, de beste av de beste - fremtidens politi. #blipoliti http://t.co/VCHwdM5O7S"
421178554164858880,2014-01-09 07:16:07,"Politihogskolen",Vil du vite meir om korleis du kan bli politi? Dra på utdanningsmessa i Halden. Her kan du få svar på dine spørsmål. #blipoliti
421226894734802945,2014-01-09 10:28:12,"Politihogskolen",Polithøgskolen og KRUS har inngått ein samarbeidsavtale. Les meir om avtalen her. http://t.co/7bWpRSyyCM
422683464224083968,2014-01-13 10:56:05,"Politihogskolen",Eit nytt nettverk mot internasjonal organisert kriminalitet vart sist tysdag presentert på Politihøgskolen. http://t.co/jcyB2qp2KC
423146928981827585,2014-01-14 17:37:44,"Politihogskolen",Politihøgskolen sine tanker går til de omkomne og etterlatte etter helikopterulykken. Mange gode kolleger i redningstjenesten sørger i dag.
423393559291920384,2014-01-15 09:57:45,"Politihogskolen","RT @Politidir: Fremdeles nedgang i anmeldte forbrytelser viser politiets krim.statistikk. Se pressekonferanse live,  http://t.co/K7akQTp4pJ"
423732120565981184,2014-01-16 08:23:04,"Politihogskolen",Ynskjer du bli politi? Da kan du ta turen til Sandefjord og få informasjon frå våre rekruteringsansvarlege. http://t.co/3jKDGbzHFG
425268351175118849,2014-01-20 14:07:30,"Politihogskolen","Ynskjer du bli politi? Kom på Politihøgskolen i Bodø, og få all den informasjonen du treng. http://t.co/3jKDGbzHFG"
425275011755028480,2014-01-20 14:33:58,"Politihogskolen","Nye jobbtal frå @Politidir, fleire nyutdanna i jobb. http://t.co/0k2gqdwUs8"
425882097035653120,2014-01-22 06:46:19,"Politihogskolen",I morgon er det klart for Utdanningskonferanse 2014. Følg oss her #phsutdanning2014
426251081065066498,2014-01-23 07:12:31,"Politihogskolen",Om to timar er det klart for Politihøgskolens Utdannigskonferanse 2014. Følg oss på #phsutdanning2014 http://t.co/6Db3a5Alwt
426280492661358592,2014-01-23 09:09:24,"Politihogskolen","""Det er viktig å invitere samfunnet til debatt."" Sjef-PHS åpner Utdanningskonferansen 2014. #phsutdanning2014"
426284710051201024,2014-01-23 09:26:09,"Politihogskolen",RT @PHSbib: I anledning #phsutdanning2014 viser vi egenproduserte bøker fra @Politihogskolen og hva vi kan tilby dere! http://t.co/iU88btF5…
426290543832731648,2014-01-23 09:49:20,"Politihogskolen","""Politiet må ha kunnskap og kompetanse slik at de kan forebygge og hjelpe i lokalsamfunnet."" Jan Bøhler (AP). #phsutdanning2014"
426313539830030336,2014-01-23 11:20:43,"Politihogskolen","@thomastveit @Michael_Naess @PFStudentene Hele debatten tas opp, og vil gjøres tilgjengelig i løpet av neste uke. #phsutdanning2014"
426315146365898752,2014-01-23 11:27:06,"Politihogskolen","@Michael_Naess @thomastveit @PFStudentene Fortsett med twittring, det vil #phsutdanning2014 ha."
426341791978106880,2014-01-23 13:12:58,"Politihogskolen","""Vi utdanner generalisten. Generalisten skal fortsette å lære gjennom hele yrkeslivet."" @kjeeck #phsutdanning2014"
426357448132132864,2014-01-23 14:15:11,"Politihogskolen","""Vi er avhengi av kommunikasjons og forstålese av etatene som jobber samen i krise."" Politioverbetjent @bjodan #phsutdanning2014"
426357730018729985,2014-01-23 14:16:18,"Politihogskolen","@bjodan Sammen, ikke samen. #phsutdanning2014"
426366909496299520,2014-01-23 14:52:47,"Politihogskolen","""Å være en god leder handler om å ha mot til å lede, og vett til å spørre."" @Lenareif  (@Kripos_NCIS ) #phsutdanning2014"
426386903265734656,2014-01-23 16:12:14,"Politihogskolen",RT @Politiforum: «Vi trenger flere med spisskompetanse i politiet»: http://t.co/SV9IFdE0c6 #phsutdanning2014
426617793149026304,2014-01-24 07:29:42,"Politihogskolen","""Kven er studentane?"" Spør førsteamanuensis Silje Fekjær. Velkommen til dag to av #phsutdanning2014 ."
426624531537489920,2014-01-24 07:56:29,"Politihogskolen","""Studentene har primært valgt yrket, ikke utdanningen i seg selv."" Sier høgskolelektor Pål Winnæss om politistudentene. #phsutdanning2014"
426679699708715011,2014-01-24 11:35:42,"Politihogskolen","""Vi vil alle bringe norsk politi videre."" Sjef-PHS avslutter og oppsummerer #phsutdanning2014."
427773656500944896,2014-01-27 12:02:42,"Politihogskolen",Fiks ferdig utdanna politi? Studie om nyutdanna politi og operativ innsats. Innlegg frå Geir Aas ved PHS.   http://t.co/7nfW6dY4PD
427821011719819265,2014-01-27 15:10:52,"Politihogskolen",Stort engasjement på PHS sin Utdanningskonferanse. Les meir på PHS sine sider: http://t.co/piiVMsv7ma Sjå og  #phsutdanning2014
428123169338044416,2014-01-28 11:11:32,"Politihogskolen",Politihøgskolen tek aktivt del i arbeidet for å styrke etterforskning i politietaten. Les meir om rapporten her. http://t.co/ORdWVgkQPi
428131201295986688,2014-01-28 11:43:27,"Politihogskolen",Frøydis (48) er ein glad og nøgd student ved Politihøgskolen. Les meir om den eldste politistudenten i landet. http://t.co/tit3eHRT6i
428882532382154752,2014-01-30 13:28:58,"Politihogskolen",3.500 vert utdanna politi dei neste fire åra. Politiet skal og få fleire spesialistar.  http://t.co/sqzQXShqR4
430735750112358400,2014-02-04 16:13:00,"Politihogskolen","PHS: Dei fysiske krava ved opptak vert ikkje lågare,snarare tvert om. Og krava til eksamen er ikkje endra. http://t.co/MVDQ7b56j8"
431107882197585920,2014-02-05 16:51:43,"Politihogskolen",Sjef-PHS Håon Skulstad stiller til debatt med Finn Skårderud i @NRKAktuelt klokken 2015. Tema: medisinske krav og psykiske helsekrav.
431362656386052097,2014-02-06 09:44:06,"Politihogskolen",Evaluering av DNA-reformen: Lite bruk av DNA-spor i såkalla vinningssaker. http://t.co/vkEzXZAcwF
431402719140515840,2014-02-06 12:23:17,"Politihogskolen",DNA-reformen har eit uforløyst potensial. Kronikk av forskarane Johanne Yttri Dahl og Heidi Mork Lomell. http://t.co/WSUEGQ4JoU
431728059738095616,2014-02-07 09:56:05,"Politihogskolen",Forskerne: Politikerne forstod ikke tallene. Dermed ble forventningene for høye til DNA-reformen.http://t.co/EYiRxJifzg
431748016572084225,2014-02-07 11:15:23,"Politihogskolen",Gratulerer @oslopolitiops med utgivelse avTwitter- boka: «Se opp for rullestol i motgående kjøreretning». http://t.co/crypm47a9Q
433559227399802880,2014-02-12 11:12:29,"Politihogskolen",Søk politihøgskolen - lenke til nettsøknad finner du her. http://t.co/R3QybVKrw8 #blipoliti
435407716899495936,2014-02-17 13:37:43,"Politihogskolen",Vi treng ungdom som vil bli politi frå heile landet. Tana lensmannskontor tek tak.  http://t.co/CZCR1yGgTr
435686487972012032,2014-02-18 08:05:28,"Politihogskolen",Ynskjer du bli politi? Kom og snakk med oss på utdanningsmessa i Grieghallen i Bergen i dag og i morgon. http://t.co/3jKDGbzHFG
436384664488796161,2014-02-20 06:19:46,"Politihogskolen","RT @Andersrom: Jeg har fått det spennende og ærefulle ansvar for å gjennomføre dette viktig kurset neste høst, med @Politihogskolen http://…"
436453180487254016,2014-02-20 10:52:01,"Politihogskolen","OL nærmer seg slutten, men hos oss er det russisk stemning. #2ol #nrksport http://t.co/UCyvd8f1D9"
436481640991588352,2014-02-20 12:45:07,"Politihogskolen",Alle med vitnemål frå PHS skal få tilbod om jobb så raskt som mogeleg. 350 nye stillingar vert oppretta og i 2014. http://t.co/dKUDDD9kFY
436817150595305472,2014-02-21 10:58:19,"Politihogskolen","Gledeleg med 350 nye politistillingar og i 2014. Viktig at nyutdanna kjem raskt i jobb, seier rektor Håkon Skulstad.  http://t.co/uEyOfwqBD5"
436875530147991553,2014-02-21 14:50:17,"Politihogskolen",Skytetrening er ein del av utdanninga - og er ikkje basert på fritida. Håkon Skulstad i ny utgåve av Sjefsbloggen. http://t.co/5qPkRbK74w
437852134587920384,2014-02-24 07:30:58,"Politihogskolen",Få eit innblikk i kvardagen til Politiet. Sesong 3 av serien Nattpatruljen har premiere på MAX i dag kl.21.00. @Politidir #nattpatruljen
438257503412170753,2014-02-25 10:21:45,"Politihogskolen","RT @Politiforum: Møt Frøydis (48), Norges eldste politistudent - vil jobbe som operativ politikvinne ute i gatene: http://t.co/uS1lxDun3F"
438296994965364736,2014-02-25 12:58:41,"Politihogskolen",Ny rammeplan for bachelorstudiet ved Politihøgskolen (PHS). http://t.co/73lOhCExcV
438677676786974720,2014-02-26 14:11:23,"Politihogskolen","Tenkjer du søke @Politihogskolen , ta ein titt på det nye opptakskravet, dykk. http://t.co/opbjPVcJeX Husk søknadsfristen 1.mars."
439019627457568769,2014-02-27 12:50:10,"Politihogskolen","RT @Opssunnmore: Søknad @Politihogskolen er 1. mars, men ikke glem følgeskjema innnen 20. mars. På  Sunnmøre mister vi søkere: https://t.co…"
439042770599436288,2014-02-27 14:22:08,"Politihogskolen",Politiet får stadig fleire tilsette-  politidekninga aukar. Ny statistikk frå @Politidir   http://t.co/CS1Umw8ZIV
439381469077983232,2014-02-28 12:48:00,"Politihogskolen","Ikkje gløym å søkje Politihøgskolen innan i morgon, 1. mars: http://t.co/K84NFwupVi #blipoliti"
440816019934687233,2014-03-04 11:48:23,"Politihogskolen",Studentane kjem aldri hit... Men dei tek juridisk metode - med 100 prosent nettbasert læring. http://t.co/Gs3JmpCWem
440816902185967616,2014-03-04 11:51:54,"Politihogskolen",RT @PHSbib: Ny master av Tom Anders Stenbro: Politiets rasjonale i endring:En diskursanalyse av politi- og lensm.etatens styr... http://t.c…
440854763702599680,2014-03-04 14:22:21,"Politihogskolen",RT @PHSbib: Trusselvurdering 2014 | PST http://t.co/DoAvgePeJZ via @PSTNorge
441160746005573632,2014-03-05 10:38:12,"Politihogskolen",Stadig flere søker Politihøgskolen.  http://t.co/jV8qCSOsUH
441546928082653184,2014-03-06 12:12:45,"Politihogskolen",Politihøgskolens webredaktør @0Karoline0 er nominert til Årets Nettredaktør. http://t.co/tc2OWtN2V5
441569693816856576,2014-03-06 13:43:13,"Politihogskolen",Åpen dag ved PHS i Oslo torsdag 13. mars. Elever ved videregående skoler - og andre interesserte - er velkommen. http://t.co/2qCnBLegvo
443312418102734848,2014-03-11 09:08:11,"Politihogskolen",Har du søkt @Politihogskolen ? Her er viktig informasjon om følgeskjema og vedlegg. #blipoliti http://t.co/4fet0Fw0NQ
443707349178785792,2014-03-12 11:17:30,"Politihogskolen",Nytt program: Utdanning for handtering av kriser - no og på nett og i distrikt. http://t.co/D3JZtGwlFh
444441454535274497,2014-03-14 11:54:34,"Politihogskolen",Open dag i Oslo for elevar ved videregåande skular. Her kan du og lese alt om krava til opptak ved Politihøgskolen. http://t.co/3p4NcCBAgC
445524163982544896,2014-03-17 11:36:52,"Politihogskolen",PHS og Høgskolen i Gjøvik har inngått samarbeid for å styrke utdanning og forskning innen cybersikkerhet. http://t.co/LYGHSYkBmc
445861798630416384,2014-03-18 09:58:31,"Politihogskolen",Nytt høyringssvar frå Politihøgskolen om medarbeiderplattform i politiet er tilgjengeleg. http://t.co/NHxTeXUW10
446209140688703488,2014-03-19 08:58:43,"Politihogskolen","I morgon er dagen. Har du søkt Politihøgskolen, ikkje gløym å sende inn følgjeskjema. Fristen er 20.03. #blipoliti"
446642251331280896,2014-03-20 13:39:45,"Politihogskolen","Profesjonell politiledelse – ja, takk, skriver @RuneGlomseth i ny kronikk.    http://t.co/W5hP6XGILp"
448443322160672768,2014-03-25 12:56:34,"Politihogskolen",RT @Politidir: Norsk politi utplassert i 24 land. Meir enn nokon sinne. Les om det i vårt magasin Norsk Politi på politi.no http://t.co/kB5…
448766194544553984,2014-03-26 10:19:33,"Politihogskolen",Doktorgrad ved Politihøgskolen: Politiinngrep i personleg fridom. Les meir om avhandlinga og Steinar Fredriksen her.  http://t.co/mRMyAC9qLV
449097930805633024,2014-03-27 08:17:45,"Politihogskolen",Ny rapport om kvitvasking frå PHS utarbeida for POD. http://t.co/F92lcKnS4V
450521974209802240,2014-03-31 06:36:23,"Politihogskolen",Hvordan måler vi politiets effektivitet? Kronikk av professor Johannes Knutsson ved PHS. http://t.co/RkrDsLXAda
450546887104671744,2014-03-31 08:15:23,"Politihogskolen",Innlegg frå rektor PHS Skulstad og viserektor forskning HiG Irgens: Fra Benny Bankboks til Master Splyntr. http://t.co/BJgGebV5MA
451016526049845248,2014-04-01 15:21:33,"Politihogskolen",Evaluering av Øvelse Tyr 2013. Sogn og Fjordane pd øvde på sjøredning - og så to høgst alvorlege og reelle kriser. http://t.co/ncpNiGErLZ
451337106494066688,2014-04-02 12:35:26,"Politihogskolen",Konferanse på Politihøgskolen 5. mai om vold mot kvinner og barn. Se programmet: http://t.co/gn4YGdcKXe
451651413148696576,2014-04-03 09:24:22,"Politihogskolen",RT @Kripos_NCIS: Kripos ber ofre for voldtekt anmelde raskt https://t.co/wIKRLxOAGt
451692828243288065,2014-04-03 12:08:56,"Politihogskolen","Fleire vil bli politi i Agder, Salten og på Vestlandet.Tal og statistikk frå distrikt og studiested finn du her. http://t.co/Ch9dP91tgI"
452004845877481472,2014-04-04 08:48:47,"Politihogskolen",Doktorgrad om etnisk kapital - og om hvorfor etterkommere av innvandrere ofte gjør det bra. http://t.co/neeRT1N83c
453151991620198400,2014-04-07 12:47:08,"Politihogskolen","Hold av datoen! Politihøgskolen, avd Bodø, arrangerer skandinavisk konferanse om politipraksis og politiforskning. http://t.co/5hpE57rRBD"
453800487780102144,2014-04-09 07:44:02,"Politihogskolen",Høgskulelektor @RuneGlomseth ved Politihøgskolen (PHS) har fått sin eigen blogg i Ukeavisen Ledelse. http://t.co/fwoPCUuEHE
453845759637848064,2014-04-09 10:43:55,"Politihogskolen","@Politidir har i dag gjort det kjend at nyutdanna politi får utvida våpengodkjenning til 18 mnd, mot 12 mnd i dag. http://t.co/9xMn2pQpVW"
454248457222782976,2014-04-10 13:24:06,"Politihogskolen",Store forskjeller på evna til å anvende forsvarleg makt. Ny rapport frå politoverbetjent Aun Hunsager Andresen http://t.co/6buettEzeJ
458888488822509569,2014-04-23 08:41:56,"Politihogskolen",Avhør av barn er etterforskning. Innlegg i @aft_meninger frå politifagleg tilsette i @Kripos_NCIS og ved PHS. http://t.co/ruoLLNenEa
459321932903878658,2014-04-24 13:24:17,"Politihogskolen",Nye tal frå Politidirektoratet: nær 9 av 10 nyutdannete med vitnemål frå PHS i 2013 er no i jobb i etaten .http://t.co/xXEswTrmYW
459620254243905536,2014-04-25 09:09:42,"Politihogskolen",@ToreBjorgo og Cato Hemmingby ved PHS skal intervjue Anders Behring Breivik. http://t.co/2GsoKDpAbl
459653882898288640,2014-04-25 11:23:20,"Politihogskolen","@thomastveit @Politidir har god oversikt over antall som går av med pensjon, og andre årsaker. Gjennomsnittet er 347."
460738976006279168,2014-04-28 11:15:06,"Politihogskolen",Tendenser i kriminaliteten - utfordringer for Norge. Ny rapport frå POD. http://t.co/iZEruV6W1U
461061789959327744,2014-04-29 08:37:51,"Politihogskolen",Kronprinsessen åpner konferanse om vald mot barn og kvinner. Konferansen er på Politihøgskolen 05.05.14 http://t.co/zfo99U3xtZ
461498759646830592,2014-04-30 13:34:13,"Politihogskolen",Vi treng at du er ein Kjernekar - og i russetida.og på festivalar. Politiet held fram innsatsen mot valdtekt.   http://t.co/gF1FoBSluP
463224753361551360,2014-05-05 07:52:42,"Politihogskolen",RT @Kronprinsparet: 09:30: @CrownPrincessMM på konferansen «Barn og kvinners rett til trygghet og ikke voldelig liv» @Politihogskolen
463969373737082882,2014-05-07 09:11:33,"Politihogskolen",Forsker Bjørn Barland ved PHS: Advarer mot kroppshysteri og idealer som påvirker ungdom til bruk av doping. http://t.co/5c9vKYtV3B
463969638078902274,2014-05-07 09:12:36,"Politihogskolen",RT @nidsenter: I dag har vi hatt opplæring i ID-kontroll ved @Politihogskolen i Bodø. http://t.co/z72eUbwr2W
464333279664275456,2014-05-08 09:17:35,"Politihogskolen","Innlegg av høgskolelektor Elisabeth Myhre Lie, PHS: Barna vi frykter og avskyr. Om ungdom, adferd og kriminalitet.  http://t.co/MOOVWtlfMn"
464756656346505216,2014-05-09 13:19:56,"Politihogskolen",Måndag er startskotet for prøvene til opptak ved Politihøgskolen. Vi gleder oss! http://t.co/aOGebGT7Vx
465127822911340544,2014-05-10 13:54:49,"Politihogskolen",Politihøgskolens forskningskonferanse 2014: Politikultur. Se program og info om deltakelse på http://t.co/ceSKF1fMJr
465841173916303360,2014-05-12 13:09:25,"Politihogskolen",Forskingsmeldinga 2013 visar høg aktivitet på formidling og forsking hjå PHS.http://t.co/9Qx7VcqErZ
466156997067694080,2014-05-13 10:04:23,"Politihogskolen",Fleire til opptaksprøvar ved PHS. http://t.co/1Q6nQOQCoX
466545028387848192,2014-05-14 11:46:17,"Politihogskolen",Ordensaksjon i Haugesund blei leia av andreårsstudentar. http://t.co/EJYTxrHTW0
466923645341016066,2014-05-15 12:50:46,"Politihogskolen",Nytt politiforskingstidsskrift i startgropa. http://t.co/syfmX2r5Or
467005329113616384,2014-05-15 18:15:21,"Politihogskolen",Flotte politistudentene i Bodø redder 17. mai for barnehagebarna. http://t.co/tS2NlShMRt
467554255269027840,2014-05-17 06:36:35,"Politihogskolen",Hipp hurra! Gratulerer med dagen. #17mai #grunnlovsjubileet
468285326277218304,2014-05-19 07:01:36,"Politihogskolen",Felles standard for bekymring: http://t.co/YbrM3mzq1v
469449779228192768,2014-05-22 12:08:43,"Politihogskolen","Misvisende om studenter, våpen og utrygghet. Førsteamanuensis Silje Fekjær har gjennomgått studentrapport. http://t.co/bDJBkSQaxE"
469451563644502016,2014-05-22 12:15:49,"Politihogskolen",@pferiksen @aft_meninger @Politidir Innlegg notert - det er bra med faglig engasjement. Vi ser på det - og så snakkes vi kanskje plutselig..
469452329142722561,2014-05-22 12:18:51,"Politihogskolen",@torbjornaas @Hoyre POD oppgir 319 flere politifaglig ansatte i etaten i 2013. 700 fra PHS. 350 nye stillinger og knappe 350 i avgang.
469452916584382464,2014-05-22 12:21:11,"Politihogskolen","@badeande Studentene møter de krav som stilles i etaten til IP4 - og må bestå disse. Kun 3-4 % stryker, opplevd mestring er subjektivt."
469453472153497600,2014-05-22 12:23:24,"Politihogskolen",@torbjornaas @Hoyre I følge POD skal stillinger i hovedregel besettes. PHS har ikke oversikt over dette. Avgang er pensjon + øvrige årsaker.
469453902371643392,2014-05-22 12:25:07,"Politihogskolen",@EirikLossius @Forsvaret_no @heimevernet Må nesten henvise til opptakskravene som ligger på phs.no Sammensatte kriterier.
