857498367303221248,2017-04-27 07:35:16,"Politihogskolen",Fleire vil ta masterutdanning hjå oss: https://t.co/ET5XnHnCud https://t.co/hzEkSoltyR
862959579780571136,2017-05-12 09:16:11,"Politihogskolen",PHS med på utviklinga av ein simulator som skal trene etterforskarar i å kjempa mot det mørke kriminelle nettet. https://t.co/jvYKVf7J5u
864418619832270848,2017-05-16 09:53:53,"Politihogskolen",Frå eksamen til arbeidskrav - og fleire forsøk: Slik er den nye skytegodkjenninga ved Politihøgskolen. https://t.co/EKyRTnSfi1
865133953417715712,2017-05-18 09:16:22,"Politihogskolen",RT @NIKUnorway: @JjosseMunch og H Bech fra @Politihogskolen om hvordan #arkeologi kan gi bedre politietterforskning https://t.co/t48mhGMuqW…
865134332171735040,2017-05-18 09:17:52,"Politihogskolen",Høgare del reelle søkjarar i opptaket til politiutdanninga.  https://t.co/raKutELLzS
866628460567023617,2017-05-22 12:15:00,"Politihogskolen","Sjef ved PHS, Nina Skarpenes, er i dag utnevnt i statsråd. Vi gratulerer!   https://t.co/OEhDeLbfue"
866629934193799168,2017-05-22 12:20:52,"Politihogskolen","@MacusSolas @MacusSolas Det gjør vi, både i teoretiske og praktiske øvelser. Alt fra trafikkulykker til stikkskader."
869508127489765376,2017-05-30 10:57:46,"Politihogskolen",Nytt høyringssvar: Instruksar om bruk av maktmiddel i politiet https://t.co/NHxTeXCMMS
872087510540791809,2017-06-06 13:47:19,"Politihogskolen",Det blir endringar for opptaket til Politihøgskolen i 2018 https://t.co/BP01Yngan6
872733451086069760,2017-06-08 08:34:03,"Politihogskolen",Rektor Nina Skarpenes åpnet i dag Forskningskonferansen 2017. Tema: Politiets samfunnsoppdrag. #PHSforsk2017 https://t.co/PL3dKmz0o9
874194373633875968,2017-06-12 09:19:15,"Politihogskolen",RT @PHSbib: Hvordan etablere/opprettholde kontakt og kommunikasjon med traumatiserte personer i avhør? Studie av P. Risan m.fl https://t.co…
874215416905773057,2017-06-12 10:42:52,"Politihogskolen",Professor Frank Aarebrot med historisk gjennomgang av politiet - og utfordring inn i cyberspace. https://t.co/1jlTTGU8QD https://t.co/zUoDDlcYQd
874531009882202113,2017-06-13 07:36:55,"Politihogskolen",@CatopsisXX Oi...... 😬
874889799378907137,2017-06-14 07:22:37,"Politihogskolen",Professor Inger Marie Sunde om viktigheten av å lære mer om datakrim og internasjonalt samarbeid i politiutdanningen. https://t.co/Raz8BsXK33
874922537226031104,2017-06-14 09:32:42,"Politihogskolen","Og apropos - rektors siste blogginlegg har det treffende tema ""Den digitale fremtiden"". https://t.co/bL2CQIJMfA"
875676666680545280,2017-06-16 11:29:21,"Politihogskolen",Gratulerer til Geir Heivoll med vel overstått disputas! https://t.co/Qc9MzgQNx0
876738259224801281,2017-06-19 09:47:44,"Politihogskolen",200 fleire får vidareutdanning i etterforsking komande studieår ved Politihøgskolen. https://t.co/QNXcz321dt
877829898504556545,2017-06-22 10:05:31,"Politihogskolen",Familie og venner er klare for å se politistudentene i Stavern motta vitnemålet. Gratulerer! https://t.co/Gz7aKyjO8l
877841821388361728,2017-06-22 10:52:54,"Politihogskolen","""Speil, speil på veggen der - hvem er de stolteste familiene i landet her""? Gratulerer Bodø! https://t.co/T6RJeIMdsK"
878167034894450689,2017-06-23 08:25:11,"Politihogskolen","Så er dagen der også for politistudentene i Oslo. Avslutning i skolegården på Majorstua, før seremoni i Rådhuset. Så er de nyutdannet politi https://t.co/WYouPhfKfa"
879603214626287617,2017-06-27 07:32:03,"Politihogskolen",Denne uka feirer Politihøgskolen skeive dager! https://t.co/d5ulfNVKjP
880742935352029184,2017-06-30 11:00:53,"Politihogskolen","@BeritRekve PHS er obs på relevante saker, inkludert dokumentarer, inn i undervisning og læring. Etterforskning og metoder har stort fokus."
880744749656924160,2017-06-30 11:08:06,"Politihogskolen",From PHS with Pride: Diversity and inclusion - in practice. Canadian ambassador @Arturmaks with Nina Skarpenes and Sarah Abraham. #oslopride https://t.co/TOuWTA6PFJ
880744889088000000,2017-06-30 11:08:39,"Politihogskolen",RT @CanadaNorway: Inspiring start to #LGBT #diversity seminar at @Politihogskolen. Rector Nina Skarpenes speaks 2need 4 police force 2mirro…
898136726484512770,2017-08-17 10:57:36,"Politihogskolen",På vei mot toppen! Studentene er på plass og er klare for å starte politilivet #perkalsatinden https://t.co/Ex3RqqqNrb
898436032223363073,2017-08-18 06:46:56,"Politihogskolen",RT @uiagder: Politibetjenter ser på seg selv som samfunnsoppdragere https://t.co/BDBQp4u3xW https://t.co/y5W9K3ypa8
901031685038452737,2017-08-25 10:41:08,"Politihogskolen",Ferske tal frå POD viser at i 2017 er jobbsituasjonen langt betre for nyutdanna politi. https://t.co/3Lrp9iby8x
907168075023339520,2017-09-11 09:04:58,"Politihogskolen",Ny doktorgrad ved PHS. Har intervjuet etterforskere som avhørte overlevende etter 22/7 https://t.co/IKSAgui9Td
910058821543956480,2017-09-19 08:31:45,"Politihogskolen",RT @PHSbib: Hvordan skapes tillit til politiet? Studie av Gunnar Thomassen (førsteamanuensis ved PHS) https://t.co/3F8woGVz4F
910059827652677632,2017-09-19 08:35:45,"Politihogskolen",PHS med høyringssvar om langtidsplan for høgare utdanning: Vil ha meir til forskning fra @Justisdep -  https://t.co/CdVFswFWZk
910848402006712320,2017-09-21 12:49:16,"Politihogskolen","PHS sitt svar på høyring om Påtaleanalysen, og behova for styrka utdanning.  https://t.co/CdVFswFWZk"
911222095975239681,2017-09-22 13:34:12,"Politihogskolen","Uaktuelt for politiet og politiutdanning, men PHS har gitt høringssvar om heldekkende plagg.  https://t.co/CdVFswFWZk"
911222711359295488,2017-09-22 13:36:38,"Politihogskolen",RT @kjonnsforskning: I år feirer Liv Finstad det hun kaller sitt «sølvbryllup» med politiet https://t.co/RGEXGMhJvU @Juss_Buss @Politihogsk…
915534282617233408,2017-10-04 11:09:17,"Politihogskolen",Førebygging av vald mot eldre i nære relasjonar. Ny artikkel frå Geir Aas ved Politihøgskolen.  https://t.co/pWKpSRXn4g https://t.co/v6JCef7wyJ
918432397577850880,2017-10-12 11:05:21,"Politihogskolen","Rektor ved PHS er bekymret for jobb til nyutdannet politi, ref. statsbudsjettet: https://t.co/QWRXP3CL1Q"
918827302913499137,2017-10-13 13:14:34,"Politihogskolen",Første del av fleire forskningsbidrag frå PHS om væpning. https://t.co/KuHKb8aOt8
922375138565337089,2017-10-23 08:12:24,"Politihogskolen",Siv R. Runhovde har disputert med forskinga si på ulovleg dyrehandel https://t.co/hjIsqveQ3n
922432555244142592,2017-10-23 12:00:33,"Politihogskolen",Politihøgskolen har gjeve sitt svar på høyringa om væpning av politiet.  https://t.co/r9Y8qaah4L
923868685772537856,2017-10-27 11:07:13,"Politihogskolen",Politihøgskolen har avgitt høringssvar om Særorganutredningen.  https://t.co/CdVFswolAK
923869961902346242,2017-10-27 11:12:18,"Politihogskolen",RT @Politidir: Ny rapport fra Politidirektoratet viser at stadig flere anmelder hatkriminalitet. https://t.co/3TzSXDb7Ae
925335010093289472,2017-10-31 12:13:52,"Politihogskolen",RT @PHSbib: Morten Holmboe @HolmboeM (førsteamanuensis ved PHS) er ute med en interessant artikkel om ungdomsstraff! https://t.co/3yyOyV8E2…
925335612902858752,2017-10-31 12:16:16,"Politihogskolen","Rektor PHS, Nina Skarpenes, har blogget om lederansvar, også for den enkelte.  https://t.co/ncDPCkBwlm https://t.co/eJzr9rnzai"
925721846200356864,2017-11-01 13:51:01,"Politihogskolen","RT @PHSbib: Om varslingsplikt vs. taushetsplikt og Morten Holmboes siste bok ""Tale eller tie"" på forskning.no! https://t.co/QlOExiY3YT"
926027579412353024,2017-11-02 10:05:54,"Politihogskolen",Nyutdannet politi vil styrke innsatsen mot overgrep og kriminalitet på nett. Digitalt politiarbeid i fokus på PHS. https://t.co/bIHPeE76vh https://t.co/5NvGAVMUT1
927903798495936512,2017-11-07 14:21:19,"Politihogskolen",Økonomisk kriminalitet skal stoppes med alle midler. Nytt studie for politiet og flere etater ved PHS. https://t.co/JOtzN65Kij
930019285937815552,2017-11-13 10:27:31,"Politihogskolen",RT @PHSbib: Korleis vel militante islamistar sine terrormål? Cato Hemmingby @hemmingby (forskar ved @Politihogskolen ) har undersøkt milita…
933599531761008640,2017-11-23 07:34:08,"Politihogskolen",Forskere ved PHS har sett på hvordan flere etater i samarbeid kom til bunns i Lime-saken. https://t.co/uu8K42lBJE
933689843284152320,2017-11-23 13:33:00,"Politihogskolen",Klokt å satse på nyutdannet politi. Rektor Nina Skarpenes kommenterer budsjettforliket og midler til ansettelser i 2018.  https://t.co/8A6VQHNBYn https://t.co/s4hHfb1l1l
934036196665319424,2017-11-24 12:29:17,"Politihogskolen","Ny spennende doktorgradsavhandling fra en av våre ansatte. Gratulerer, Hild Rønning! https://t.co/O38rZXeLFf"
937667711047471104,2017-12-04 12:59:37,"Politihogskolen",Rektor Nina Skarpenes med blogg på tampen av 2017: Godt nytt kunnskapsår.  https://t.co/PckOIliaSA https://t.co/0TXyZGJTRe
937667860406685697,2017-12-04 13:00:13,"Politihogskolen","RT @PHSbib: Ny rapport ute: ""Trusler og utfordringer innen IKT-kriminalitet (2017)"" https://t.co/bkZJMiTK3Z"
939126275448467457,2017-12-08 13:35:26,"Politihogskolen",Viktig beslutning: Omorganisering av særorganene i politiet er satt på vent til man ser effekten av nærpolitireformen i politidistriktene. https://t.co/exOJh13lFk
943114066305970178,2017-12-19 13:41:30,"Politihogskolen","RT @PHSbib: Les Hild Rønnings doktorgradsavhandling i PIA, bakgrunnen for artikkelen i forskning.no  https://t.co/j690Lilzmd  https://t.co/…"
943419800944070657,2017-12-20 09:56:23,"Politihogskolen",RT @PHSbib: Kva har Sherlock Holmes og moderne etterforsking i lag? Ole Thomas Bjerknes (politioverbetjent PHS) og Ivar A. Fahsing (politio…
943471370394009600,2017-12-20 13:21:18,"Politihogskolen",RT @PHSbib: Tor-Geir Myhrer (professor ved PHS) debatterer mangler i arbeidet med ny straffeprosesslov i siste nummer av Tidsskrift for str…
948118155372711938,2018-01-02 09:05:58,"Politihogskolen","Flere saker der politiet har opptrådt kritikkverdig, blir ikke tatt alvorlig av politilederne, ifølge forsker ved PHS https://t.co/dKWrLrxTKy"
950720769927020544,2018-01-09 13:27:49,"Politihogskolen",RT @Politidir: For første gang er innbyggerne i Norge mest bekymret for å bli rammet av nettbasert kriminalitet.https://t.co/zogxbnrbKr
951811851943399425,2018-01-12 13:43:23,"Politihogskolen","Ny politihøgskole bør byggjast i Oslo, og faglege argument må vere styrande. Innlegg frå rektor PHS og politimesteren i Oslo. https://t.co/6RiVMBZ0qg https://t.co/TI6082vyJF"
952843591138926592,2018-01-15 10:03:09,"Politihogskolen",Trusler mot norske politikere. Spørreundersøkelse legges frem ved PHS Majorstua onsdag 17.januar fra 13.00 - 14.30. Åpent for media.  https://t.co/I6EgfBKkyz https://t.co/9PmZgKeA9X
953636294424432641,2018-01-17 14:33:04,"Politihogskolen","Trusler og trusselhendelser mot politikere, rapport lagt frem på PHS i dag.  2 av 5 har opplevd alvorlige trusler, 4 av 5 uønsket atferd. Her er rapporten: https://t.co/shQOTaNpk1 https://t.co/LjhsFlH6CX"
956859282183655424,2018-01-26 12:00:05,"Politihogskolen",Studenter ved PHS skal ved hjelp av ny pensumbok lære enda mer om viktigheten av sosial interaksjon med publikum https://t.co/2ywKV6Gv9b
957915383121567744,2018-01-29 09:56:39,"Politihogskolen",Kriminelle i arbeidslivet må stanses med alle midler. Ny felles utdanning for mange etater ved ved PHS. Kronikk i @Politiforum. Les hele innlegget:  https://t.co/1qi3bF0wzH https://t.co/8xqpWQOgOx
960423142345924608,2018-02-05 08:01:35,"Politihogskolen",Politistudentene er mest tilfredse med studiet! Nye tall fra Studiebarometeret er ute. https://t.co/3UemVyy3KT
960449493706698754,2018-02-05 09:46:18,"Politihogskolen",PHS gratulerer selvsagt - vi kommer tilbake med litt mer om saken og den nye professorens arbeider. https://t.co/h645LarNO1
960453764212772865,2018-02-05 10:03:16,"Politihogskolen","PHS pressetelefon 488 87 934 vil grunnet sykdom ikke være betjent i perioden 5.2 - 12.2. Men, send gjerne en mail til info@phs.no, så tar vi tak i henvendelsen så raskt som mulig. Noe ventetid må påregnes. https://t.co/ZXYjI53g3N"
960873783312732161,2018-02-06 13:52:16,"Politihogskolen",Lihkku beivviin!
960897269481508864,2018-02-06 15:25:36,"Politihogskolen","Statsråd Sylvi Listhaug fra @Justisdep besøkte PHS, orientering om utdanninger og utvikling. Politistudentene fikk også positive jobbtall for nyutdannet politi.  https://t.co/fIpFwPZQJq https://t.co/4VqRXB2iz7"
961970804392120321,2018-02-09 14:31:26,"Politihogskolen","En politiutdanning som virker, trenger ikke å repareres. Tanken om å dele grunnutdanningen i flere linjer gir ikke flere spesialister. Innlegg i @Politiforum fra rektor Nina Skarpenes. https://t.co/tRBMb1vPdL https://t.co/cyqHR0KabH"
962994282998222850,2018-02-12 10:18:23,"Politihogskolen",Tone Davik fra @Kripos_NCIS og Inger-Liste Brøste fra PHS leder den nye utdanningen for avhørsledere for tilrettelagte avhør ved høgskolen. Første kull klar for eksamen. https://t.co/OJW2ekvgQp https://t.co/FMQqkCmV9z
966954580083867648,2018-02-23 08:35:11,"Politihogskolen",Hvordan kan vi være så uenige om bevæpning av politiet? Hvordan gjennomfører man store terrorøvelser? Aktuelt om operativt politiarbeid i hverdag og krise på Forskningskonferansen i juni: https://t.co/oiOzqNdpit
969518174998810624,2018-03-02 10:22:00,"Politihogskolen","Ordfører @MarianneBorgen trosset kaldværet og kom på fredagsvisitt til PHS, hvor rektor Nina Skarpenes tok henne varmt imot. Takk for besøket! https://t.co/ToQVPwQedZ"
970969612635516928,2018-03-06 10:29:30,"Politihogskolen","Årets søkertall er klare. 4 706 har søkt Politihøgskolen i år, og kvinneandelen er høyere enn noen gang. https://t.co/yahuGuglGl"
971011951362035712,2018-03-06 13:17:44,"Politihogskolen",I dag hadde vi besøk av justiskomiteen. Takk for et hyggelig møte! Her er rektor Nina Skarpenes sammen med justiskomiteens første nestleder Jenny Klinge og Politihøgskolens studentrådsleder Mari Holmedahl. https://t.co/oxO0OObGct
971749526880047104,2018-03-08 14:08:36,"Politihogskolen",«Kvinnedagen er også en påminnelse om politiets forpliktelser overfor kvinner» sier rektor Nina Skarpenes i sitt nyeste blogginnlegg. PHS gratulerer alle kvinner og menn med dagen! https://t.co/8n5jGe2Hgr  Foto: Kåre Magnar Hansen https://t.co/TPmdSOyAj7
981101118976643072,2018-04-03 09:28:29,"Politihogskolen",Politihøgskolen har avgitt høringssvar om fremtidens behov for kapasitet og kompetanse. Høgskolen advarer blant annet mot en stor reduksjon i opptak av studenter til bachelorutdanningen. https://t.co/LxCHNgn0rr https://t.co/JEdKT7DkLm
983335960023916544,2018-04-09 13:28:57,"Politihogskolen",Solid mønstring for bedre beredskap. Nær 300 deltakere. #beredskap2018  https://t.co/VSgrWMFs3I https://t.co/C7EBpXEZmg
984340574324084737,2018-04-12 08:00:55,"Politihogskolen",Har du tenkt deg på Politihøgskolens Forskningskonferanse 7-8. juni? Tema i år er «Operativt politiarbeid i hverdag og krise - er vi forberedt?». Program og påmelding finner du her https://t.co/Mdv8su96fK https://t.co/QVYHp8acpM
986152638256427008,2018-04-17 08:01:25,"Politihogskolen",Distriktsvise søkertall: Flest søkere til bachelor i politiutdanning fra Øst politidistrikt: https://t.co/Gnq74WycaE
986170040658644992,2018-04-17 09:10:34,"Politihogskolen",RT @Politiforum: – Det er ikke en målsetting at studenten skal mestre alle politioppgaver etter første studieår. Geir Valaker ved @Politiho…
986229498621423616,2018-04-17 13:06:50,"Politihogskolen",Forskningskonferansen har fått egen nettside: https://t.co/EmmUAQTzki
989130772643745794,2018-04-25 13:15:28,"Politihogskolen",Vi gleder oss over hyggelige nyheter i dag! 80 prosent av de som gikk ut av Politihøgskolen i fjor er nå i jobb i politiet. https://t.co/RlTY1tyBcg
992304175751970818,2018-05-04 07:25:26,"Politihogskolen",Ingen automatikk i at flytting av Politihøgskolen fører til store besparelser: https://t.co/sGYnu5WFBl
992365282059542528,2018-05-04 11:28:15,"Politihogskolen",RT @Politiforum: Å advare mot politi­utdanning er et bomskudd. Politiets Fellesforbunds utspill bidrar til å snakke ned politiyrket som yrk…
995947319685197824,2018-05-14 08:41:59,"Politihogskolen","Professor Inger Marie Sunde og forskningsmiljøet ved PHS ønsker å styrke kontakten med personene i politiet gjennom spalten «Nytt fra PHS Forskning», som hadde oppstart i aprilnummeret til Politiforum. https://t.co/ii9A4HWb0K"
996325134133858304,2018-05-15 09:43:17,"Politihogskolen","Rektor Nina Skarpenes og Politihøgskolen forbereder redusert opptak av bachelorstudenter i 2018, etter fremleggelse av revidert statsbudsjett. https://t.co/NA2B3dnrs1 https://t.co/dAd6Al4O4c"
1004310936843407361,2018-06-06 10:36:01,"Politihogskolen","Videreutdanning øker ved Politihøgskolen, og etterforskning øker mest. Avdelingsleder Siw Thokle (bildet) gir status - og peker på behov for fremtiden. https://t.co/Km1Ix0QJc1 https://t.co/LVWhBfRDW6"
1006487289982308352,2018-06-12 10:44:04,"Politihogskolen","""Dr Detektiv"" @Ivafah - Ivar Fahsing ble tildelt Formidlingsprisen under Politihøgskolens forskningskonferanse. Les mer om det - og selve konferansen: https://t.co/mI7fEmKcXG https://t.co/XylkS6Wkex"
1008608884121063429,2018-06-18 07:14:31,"Politihogskolen","Opptaket til bachelorutdanningen ved Politihøgskolen reduseres fra 720 til 550 studenter, med virkning fra høsten 2018. Dette er klart etter at Stortinget behandlet revidert nasjonalbudsjett fredag 15. juni. https://t.co/RVzyK07GcR https://t.co/MVPiByEktC"
1010129174567247874,2018-06-22 11:55:37,"Politihogskolen",Klar for politiyrket! Avslutninger ved Politihøgskolens studiesteder i Bodø og Stavern torsdag 22. juni. Vi gratulerer! https://t.co/fZvngFvcCx https://t.co/IIKyc3dhFa
1011566119021350912,2018-06-26 11:05:31,"Politihogskolen","Nyutdannet politi på rekke og rad, i Stavern, Bodø og Oslo, bredt formidlet via @Politiforum Les også mer i PHS sitt presserom https://t.co/k4fVG9I2o4 https://t.co/Ckh6wdXgFm"
1011885384270254080,2018-06-27 08:14:10,"Politihogskolen","@Ivafah gjesteblogger sammen Norsk Senter for Menneskerettigheter denne uken om avhør, etterforskning og menneskerettigheter på hjemmesiden til britisk UD: https://t.co/TCBkxLN1uu"
1013729718523387905,2018-07-02 10:22:53,"Politihogskolen","Takk for i år, Pride! https://t.co/wPNy00fGzj"
1015229951040159744,2018-07-06 13:44:17,"Politihogskolen",Rune Glomseth om hva som kjennetegner kloke ledere: https://t.co/pIoLIblqok
1017302671454277632,2018-07-12 07:00:32,"Politihogskolen","Det snakkes om parallellsamfunn i Norge. Men har vi det? Nei, mener politiforskerne. https://t.co/b0nt65GUgd"
1019884962324123648,2018-07-19 10:01:38,"Politihogskolen",Tall fra hovedopptaket: Høyere poenggrenser for å ta bachelor i politiutdanning. https://t.co/CHn9I3qzFn
1020281235887751170,2018-07-20 12:16:17,"Politihogskolen","Pressevakttjenesten vår holdes nå stengt frem til 06.08 grunnet ferieavvikling. Henvendelser kan i mellomtiden sendes til info@phs.no, og vil bli besvart fortløpende etter 06. august.  https://t.co/0QUxgoM23l"
1028953195144462336,2018-08-13 10:35:33,"Politihogskolen","Møt rektor Nina Skarpenes og en politistudent på politiets stand, onsdag fra 14.00-17.00. #arendalsuka2018 https://t.co/7Wv3uAnrCT"
1034381283407945729,2018-08-28 10:04:50,"Politihogskolen","Vi treng fleire politiansatte som tek masterutdanning i åra som kjem, skriv rektor Nina Skarpenes i sitt seinaste blogginnlegg. https://t.co/wRYuWH92lM https://t.co/GVG4C8dyhL"
1034424496109899776,2018-08-28 12:56:33,"Politihogskolen",Vi har levert vårt høringssvar om forslag til endringer i straffeloven: https://t.co/IhJeN4purq
1037339439801008130,2018-09-05 13:59:29,"Politihogskolen","Politihøgskolen setter pris på besøket fra statsråden. @TMWara orienterte seg om høgskolens virksomhet, muligheter og utfordringer. Her sammen med rektor Nina Skarpenes og siste års politistudent Kamilla (t.v). https://t.co/MZjiyRSBNY"
1037687250161729536,2018-09-06 13:01:34,"Politihogskolen",Politistudentane i Stavern fekk i dag besøk av @Kronprinsparet og viste frem noko av det dei trenar på under utdanninga. https://t.co/wC02LKBJNq
1041943655718825984,2018-09-18 06:55:00,"Politihogskolen",Dette mener vi om @Justisdep's forslag til nytt straffebud mot deling av krenkende bilder og filmer: https://t.co/SBn3HoceD1
1041957251450392576,2018-09-18 07:49:02,"Politihogskolen",For første gang tilbyr vi nytt studie om hatkriminalitet. Gjennomføres allerede fra denne høsten. https://t.co/SNHWmZQCM8
1042313721077526528,2018-09-19 07:25:31,"Politihogskolen","@BeritRekve Hei, Berit! Det skal gjennomføres nå i høst med 24 studieplasser i første omgang."
1042382195409788928,2018-09-19 11:57:36,"Politihogskolen","@BeritRekve Oi, du har så rett! Vi endrer. Takk som følger med ;)"
1044561144470482944,2018-09-25 12:15:58,"Politihogskolen",Lære hele livet. Rektor Nina Skarpenes om utdanninger - kurs - og kompetanse for læring. https://t.co/GqwcleyTiy https://t.co/Ob2Xz6GVJY
1047390546824765441,2018-10-03 07:39:00,"Politihogskolen",Hvordan lærer politiledere ledelse? https://t.co/zyqTzYs2UE
1049642212999467008,2018-10-09 12:46:19,"Politihogskolen",Forslaget til statsbudsjett: Muligheter og bekymringer. Rektor Nina Skarpenes ved Politihøgskolen er ute med ny blogg. https://t.co/Cd8mfQm1W9 https://t.co/IzweelpKe3
1051804865826095104,2018-10-15 11:59:56,"Politihogskolen",Medieinvitasjon til lansering av rapport om høyreekstremisme i Norge på Politihøgskolen i Oslo neste mandag: https://t.co/DEU3R1IQ5u
1052161159971950594,2018-10-16 11:35:43,"Politihogskolen",Fagansvarleg Per Håkon Sand (biletet) og Politihøgskolen er klar for å gi fleire utdanning i politimyndigheit. Og spesialistar inn mot etterforsking. https://t.co/ew0NEHAvfm https://t.co/gU8IburciC
1052546736907005952,2018-10-17 13:07:52,"Politihogskolen","Nye jobbtal for nyutdanna politi gjev grunn til uro. No skal mange stillingar lysast ut mot slutten av året, men fleire må vente enn tidlegare. https://t.co/MtxdFwPyWV https://t.co/LOboBaY02k"
1052581418243694594,2018-10-17 15:25:40,"Politihogskolen",@Politiforum Politihøgskolen hilser til @PF_offisiell - og gratulerer @glmetlid!
1054253363104231424,2018-10-22 06:09:23,"Politihogskolen",Ny rapport om høyreekstremisme i Norge lanseres hos oss klokken 10.00 i dag: https://t.co/Uvhb5JPBmz
1054283412851355648,2018-10-22 08:08:47,"Politihogskolen",Fersk rapport om høyreekstremisme i Norge er nå tilgjengelig for nedlastning: https://t.co/c9v0D0L9Pn
1054655159731658757,2018-10-23 08:45:59,"Politihogskolen","Vi vet for lite om de langsiktige effektene av forebygging av kriminalitet, viser ny kunnskapsoversikt. https://t.co/DuBgEQftmA"
1059365163181191168,2018-11-05 08:41:51,"Politihogskolen","Er du forsker/doktorgradsstudent som jobber med relevant tema innen politiets ""stopp og sjekk""-metoder? Vi vil komme i kontakt med deg som ønsker å bidra inn i nytt EU-nettverk om temaet. Send en mail til ransol@phs.no. https://t.co/PGBnr9hOVI"
1059400167034667009,2018-11-05 11:00:57,"Politihogskolen",Myten om unyttig politiforskning. Rektor Nina Skarpenes med ny blogg. https://t.co/P2JiXaaXLZ https://t.co/OgswgV94UO
1061894427373907968,2018-11-12 08:12:15,"Politihogskolen",Utøya-studien: Etterforskerne opplevde dilemma mellom objektivitet og empati i avhør med overlevende. https://t.co/uDR73VSCKk
1063012732440588290,2018-11-15 10:15:59,"Politihogskolen","Ny Nordisk master i politiledelse skal bidra til å bygge ny og fremtidsrettet kompetanse på strategisk nivå, sier rektor Nina Skarpenes.      https://t.co/ecOYMnznGO https://t.co/BeQQqx7653"
1065178344986152960,2018-11-21 09:41:22,"Politihogskolen","Er loven tydelig nok på hva politiattestene skal inneholde? Nei, mener  professor @HolmboeM, en av forfatterne bak ny bok om vandel. https://t.co/yiAwoXK6Ux"
1067351747813888000,2018-11-27 09:37:41,"Politihogskolen",De beste finnes i hele befolkningen. Rektor Nina Skarpenes med blogg om betydningen av å rekruttere både kvinner og menn - til fagområder og lederstillinger. https://t.co/UMCdGKH22A https://t.co/xU4llYptEQ
1067407895510302720,2018-11-27 13:20:48,"Politihogskolen",Birgitte Ellefsen disputerer fredag 7. desember 2018 for ph.d.-graden ved Universitetet i Bergen med avhandlingen «Politiens politikk og politikkens politi. Norske politireformer i perioden 1682-1866». https://t.co/NpHdeSkK9E
1067744569368940544,2018-11-28 11:38:37,"Politihogskolen","Rektor hos oss Nina Skarpenes har tatt en prat med @Politilederen om politiutdanning, forskning og lederskap. https://t.co/KnwLTQtPQY"
1068450669236051968,2018-11-30 10:24:25,"Politihogskolen","Gratulerer med ny bok! ""Juss for utøvere av begrenset politimyndighet"" er nå tilgjengelig hos Gyldendal. Boken gir en samlet fremstilling av reglene for tildeling og utøvelse av begrenset politimyndighet. https://t.co/9mgbAKY46y"
1068484620440735749,2018-11-30 12:39:19,"Politihogskolen",Vi har nytt presserom: https://t.co/Wu1fnqaDwz. Følg oss for å få nyheter om Politihøgskolen.
1070224326589325312,2018-12-05 07:52:17,"Politihogskolen","Må politiet endre sine grunnprinsipper om å være desentralisert, lokalt og forebyggende etter nærpolitireformen? Det mener politiforskerne. I dag gir de ut ny bok om politireformer. https://t.co/5fu8L7yEM1"
1071016889030201344,2018-12-07 12:21:39,"Politihogskolen",Gratulerer til Birgitte Ellefsen med doktorgraden! https://t.co/2wJDClWqCE
1073500879045779456,2018-12-14 08:52:08,"Politihogskolen",Professor Tom Tyler from Yale Law School came to visit us. Thank you for an excellent lecture on procedural justice! https://t.co/RxjLALBuTL
1075721554179301376,2018-12-20 11:56:19,"Politihogskolen","Velkommen som blivende politidirektør, @BBjornland. Og ja, du har helt rett i at vi har et av verdens best utdannede politi ;) https://t.co/k8FaUUeCZq"
