524464058683375617,2014-10-21 07:35:50,"Politihogskolen",Bekymring er bra for barn og ungdom - skriv høgskulelektor frå PHS saman med politiinspektør i POD. http://t.co/yMIJ0NxxZW
524492262844428289,2014-10-21 09:27:54,"Politihogskolen",Nytt høyringssvar om nye digitale læringsformer i høgare utdanning. http://t.co/TJkxEFv4BR
524905445157531648,2014-10-22 12:49:45,"Politihogskolen",Sigve Bolstad rosar nyutdanna politi og norsk politihøgskule-utdanning. http://t.co/y82RtcMbwZ
525188330921918464,2014-10-23 07:33:50,"Politihogskolen",RT @Politidir: Ny utgave av magasinet Norsk Politi er klar: http://t.co/W4BP3cIFiY
525209416908673024,2014-10-23 08:57:37,"Politihogskolen",Trafikkmelding: I Sørkedalsveien møtar du no politistudentar med lova i handa. Dei øvar på trafikkontroll. Noko kø. http://t.co/m7vYWifyVf
526743353594224640,2014-10-27 14:32:56,"Politihogskolen",Redningsetatene møter kritikken fra Gjørvkommisjonen. I dag starter pilotkurs i lederutdanning for innsatspersonell.  http://t.co/KcDnRzJTfd
527072208141963264,2014-10-28 12:19:41,"Politihogskolen",Kva meiner politiutøveren sjølv om politiutdanninga? Geir Aas ute med ny rapport http://t.co/zcElYUtanF
527108950005936129,2014-10-28 14:45:41,"Politihogskolen",De beste forskningsformidlerene viser hva god formidling er. #forskningno http://t.co/BRriouAch1
527379357502025728,2014-10-29 08:40:11,"Politihogskolen",RT @Politidir: Ventetiden for barneavhør går ned. Målet er å komme under 30 dager i slutten av åre http://t.co/Av6VVkOdi1
527390433761316866,2014-10-29 09:24:12,"Politihogskolen",Her kan du se dialogkonferansen 2014 mellom myndighetene og innvandrerbefolkningen. Direkte. http://t.co/7jA82O1xHz
527390536567898113,2014-10-29 09:24:37,"Politihogskolen",RT @pcjawick: PLIVO=PågåendeLIvstruendeVOld: felles og felles handling med politi brann helse @Luftambulansen @Politihogskolen http://t.co/…
527451539590610944,2014-10-29 13:27:01,"Politihogskolen",RT @Noednett: #DNK gratulerer @polititelemark som i dag har tatt i bruk #Nødnett. 13 av 27 politidistrikter er nå på #Nødnett http://t.co/L…
528146205205749760,2014-10-31 11:27:22,"Politihogskolen",Kantina i Kongsvinger tek Halloween på alvor. Zombiene i kjøkkenet lagar uhyrlege matrettar til studentane. http://t.co/Kn7pVKAHRz
529594963840225281,2014-11-04 11:24:13,"Politihogskolen",Dei som rekrutterer dei beste av dei beste er samla på seminar. #fremtidenspoliti http://t.co/5wAQpddXrs
529603982239739905,2014-11-04 12:00:03,"Politihogskolen",Professor Knutsson frå @Politihogskolen lanserer i dag artikkelsamlinga «Applied Police Research». Velkommen på lansering kl.15 på PHS.
530259733425688576,2014-11-06 07:25:46,"Politihogskolen","Sjå liveoverføring frå Radikaliseringskonferansen, klokka 0900. http://t.co/lY4tgn5def #radkonf"
530269935160033280,2014-11-06 08:06:19,"Politihogskolen",@AndersAnundsen ønskes velkommen av rektor Nina Skarpenes ved @Politihogskolen #radkonf http://t.co/StVpNkp0yJ
530341518343962625,2014-11-06 12:50:45,"Politihogskolen",Høyaktuell konferanse om radikalisering og valdelig ekstremisme. http://t.co/PLHxC5Enq1 #radkonf
530663998346522624,2014-11-07 10:12:11,"Politihogskolen","Politiet skal førebyggje kriminalitet, og studentane ved @Politihogskolen har viktig førebyggjing på timeplanen. http://t.co/7fuAahO0pQ"
531712142970748928,2014-11-10 07:37:08,"Politihogskolen","Ny, viktig bok om politiforskning frå professor Johannes Knutsson. http://t.co/Y5fQlFaHfh"
531783006693109760,2014-11-10 12:18:43,"Politihogskolen","Speglar kriminalitetsbiletet i samfunnet eit behov for politivæpning? Nei, skriv Johannes Knutsson i sin kronikk: http://t.co/k8a16BfgKc"
531808775121154049,2014-11-10 14:01:07,"Politihogskolen","@thomastveit Knutsson er professor ved PHS, har skrevet en kronikk som vi deler i våre kanaler. Fritt frem for meninger."
532180097336606720,2014-11-11 14:36:37,"Politihogskolen",RT @Regjeringen: Kriminalitet må bekjempes med samarbeid http://t.co/oDloecDcDL
532896336300212224,2014-11-13 14:02:41,"Politihogskolen","Det var blålys, sirener og høy fart då Aftenbladet TV følgde politistudentar under opplæring i utrykkingskøyring. http://t.co/XWujmL0FMv"
533238790341808128,2014-11-14 12:43:29,"Politihogskolen",Vi gledar oss over ny sesong av Nattpatruljen som kjem til våren. Politihøgskulen brukar serien aktivt i undervisninga.
534286228389384193,2014-11-17 10:05:38,"Politihogskolen",Studentane ved PHS er med på å utvikle utdanninga. Meiningane om utdanninga er derimot delte. http://t.co/hNZOKcq9C0
534645594602897408,2014-11-18 09:53:37,"Politihogskolen",Høyringssvar til @Justisdep - Politihøgskolen ønskjer ny behandling om generell væpning. http://t.co/fL3lUJ6HPI
535041601689882624,2014-11-19 12:07:13,"Politihogskolen","Flott syn! Ca 40 praksisrettleiarar med ansvar for tilsaman 37 stud. i B2, samla på PHS. http://t.co/bTghy4mlwN"
535367859854409728,2014-11-20 09:43:39,"Politihogskolen",Politihøgskolen er klar for konferanse i Bodø #PHSpolitipraksis http://t.co/xP70gQ0NmR
535402678583832576,2014-11-20 12:02:00,"Politihogskolen",Politibetjent Kathrine Hamre forteller om politiet sin praksis. #PHSpolitipraksis http://t.co/xMjOrXeRcq
535700685934063617,2014-11-21 07:46:11,"Politihogskolen","Boka «Tegn og symptomer på misbruk av narkotika eller andre rusmidler», er revidert og publisert http://t.co/6HSTzHqCBb"
535702072281554944,2014-11-21 07:51:41,"Politihogskolen","Professor Ruth H. Olsen åpner andre dag av #PHSpolitipraksis Hvordan kan praksiserfaring, forskning og utdanning virke sammen?"
535722050032504832,2014-11-21 09:11:04,"Politihogskolen",Kven er dei svenske politistudentene etter sju år? Universitetslektor Lauritz frå Umeå Uni. #PHSpolitipraksis http://t.co/6qSBmFdD5b
535732233731321856,2014-11-21 09:51:32,"Politihogskolen",Tidligare Delta-sjef Snortheimsmoen fortel om politikultur. #PHSpolitipraksis http://t.co/vHiQrxFTQW
537539866461237248,2014-11-26 09:34:25,"Politihogskolen",RT @PF_offisiell: Sigve Bolstad gjenvalgt som leder av Politiets Fellesforbund #pflandsmøte2014 http://t.co/FFgmwKpVyM
537551290663178240,2014-11-26 10:19:49,"Politihogskolen","Forskningsbasert kunnskap skal løfte politiet, ""sjefsbloggar"" rektor Nina Skarpenes. http://t.co/jeo3GFJ3AY"
537596086400323584,2014-11-26 13:17:49,"Politihogskolen",Vi gratulerar Bård Stensli med Ildsjelprisen. Ein viktig mann i rekrutteringa av nye politistudentar. http://t.co/tD36xeK7QJ
538263238316933120,2014-11-28 09:28:51,"Politihogskolen","Politistudentane, kven er dei og kvifor ønskjer dei å bli politi? http://t.co/boQLuZN7qp"
539711513255505920,2014-12-02 09:23:46,"Politihogskolen","RT @PHSbib: 80 morgenfriske studenter møtte til #eksamensfrokost i biblioteket. Takk for oppmøtet, vi heier på dere! http://t.co/tXGE5xiAs3"
539740908754059264,2014-12-02 11:20:35,"Politihogskolen",Meld deg på Politihøgskolens utdanningskonferanse i februar om politiutdanning i endring http://t.co/1c8LP6qAbW #phsutdanning
539786505796210688,2014-12-02 14:21:46,"Politihogskolen",Nye tal: 8 av 10 nyutdanna politistudentar frå 2014 jobbar no i etaten. http://t.co/08kpxYHYCR
540122443843928064,2014-12-03 12:36:40,"Politihogskolen",Seminar om førebygging av radikalisering og terrorisme på Politihøgskolen 16. desember. http://t.co/9VO2JbEwzE
540425704006238208,2014-12-04 08:41:43,"Politihogskolen",16 toppolitikarar er blitt utsett for vald. Det viser ei undersøking forskarar ved PHS har gjort på oppdrag frå PST. http://t.co/OpPiDPqhlO
540470887544549376,2014-12-04 11:41:15,"Politihogskolen",Timeantallet for bachelorstudentenes effektive skytetrening er bortimot doblet siden 2007. http://t.co/DrUz6dZkBm
541964614192611328,2014-12-08 14:36:47,"Politihogskolen",Bli leseinspirert! Vi har laga video frå PHS biblioteks eksamensfrukost førre veke. http://t.co/RgvdAmazaL
542679273845571584,2014-12-10 13:56:36,"Politihogskolen",9.-10.12  - Politihøgskolen arrangerte for tredje år etterforskingsseminar for politiutdannere. http://t.co/EH3Lr3B5nu
542980477758750720,2014-12-11 09:53:28,"Politihogskolen",Personer med etnisk minoritetsbakgrunn og deres foreldre ønskes velkommen til informasjonskveld ved PHS 13. januar. http://t.co/OMxyzhjHIp
543030898640568320,2014-12-11 13:13:49,"Politihogskolen","Arbeidet som gjerast kvar einaste dag for barns sikkerheit er godt, men likevel for dårleg, skriv PHS-faglærar. http://t.co/T4bI1NOxqv"
543364337948450816,2014-12-12 11:18:48,"Politihogskolen","Rektor, Nina Skarpenes, er i statsråd i dag beskikket til å fortsette som sjef for PHS. http://t.co/o55pIAj2zK"
544860287355326465,2014-12-16 14:23:10,"Politihogskolen",RT @PHSbib: Ny rapport fra @Kripos_NCIS  og @politidir om kriminalitet i arbeidsmarkedet  http://t.co/EFuMJBzVpd
545150430603661312,2014-12-17 09:36:05,"Politihogskolen",Politiet sin organisering av terrortrusselen i sommar (OP Sommar) var i all hovedsak vellukka:  http://t.co/0khf778Wdg
545503826556780544,2014-12-18 09:00:21,"Politihogskolen",Gledelege tal frå innbyggjarundersøkinga visar at nesten ni av ti har høg tillit til politiet. http://t.co/m13eu71RIY
546990117429456896,2014-12-22 11:26:21,"Politihogskolen","Mest lest i PIA - PHS sitt opne arkiv, i 2014:Jakten på risiko, doktorgradsavhandling frå @Kristin_HK . Topp 10: http://t.co/HePhyxMDhp"
549912475395960833,2014-12-30 12:58:45,"Politihogskolen","UP gjer ein viktig jobb på vegen. Talet på trafikkdrepne er i 2014 gått ned, men ulukkene er fortatt for mange http://t.co/dNs0tmr71Y"
550954612216561664,2015-01-02 09:59:50,"Politihogskolen",RT @Politidir: Måling og krav til politiets responstid i 2015 https://t.co/dbapluxFrt #politi
550959068681371648,2015-01-02 10:17:32,"Politihogskolen",Er du i gong med å trene til dei fysiske testane? Hugs at videoar av alle testane ligg på You Tube. God trening! http://t.co/ZGKmZWlCQp
552105975306801152,2015-01-05 14:14:56,"Politihogskolen","RT @Vinningsgruppen: Fra og med i dag har vi skiftet navn til @Vinningsgruppen Sentrum. Vi har nå ansvar for lommetyveri, skimming og ID-ty…"
552383836420857856,2015-01-06 08:39:04,"Politihogskolen","Les forskar ved Politihøgskolen, Cato hemmingby, sin kronikk i @aft_meninger . ""Væpnet politi er ingen løsning"". http://t.co/B8YHzh2Fha"
552398928847843329,2015-01-06 09:39:02,"Politihogskolen","Påmeldinga til PKF-konferansen 2015 ""fremtidens forebygger"" - nærvær på data og gata, er i åpna.@FokusPKF. http://t.co/63AgaRenwi"
552729683796951040,2015-01-07 07:33:20,"Politihogskolen",Vold mot barn i hjemmet: Hvordan ivareta barns rettigheter? Ny artikkel av høgskolelektor Edvardsen PHS og Mevik UIN http://t.co/h1QsEhKDcJ
552788627290599424,2015-01-07 11:27:33,"Politihogskolen","Politiet har som mål å spegle samfunnet, difor ynskjer PHS og @SVakhtar fleire studentar med minoritetsbakgrunn. http://t.co/zyF7gHmZXD"
553163951190835200,2015-01-08 12:18:57,"Politihogskolen",Vil du vite meir om politiet sin kvardag? Sjå Jetmund og Ola på jobb i sitt politidistrikt. http://t.co/PzICMsXRRL
553473520869838849,2015-01-09 08:49:05,"Politihogskolen","Rektor ved Politihøgskulen, Nina Skarpenes, gjesteblogger på ""Politikvinne"". Tema er politi og leiing. http://t.co/BdpnOGyvkt"
554642076810616833,2015-01-12 14:12:30,"Politihogskolen",Påmelding til Politihøgskolens utdanningskonferanse 04-05.02 er opna: http://t.co/1c8LP6qAbW
555342216504549376,2015-01-14 12:34:36,"Politihogskolen",Rundt 150 deltok då vi inviterte søkjarar med minoritetsbakgrunn til infokveld. Sjå videorep: http://t.co/r1X9wZtJet http://t.co/yTJMZMjVlj
555706517002145792,2015-01-15 12:42:12,"Politihogskolen",RT @Politidir: Det er fortsatt nedgang i anmeldt kriminalitet viser rapport fra politiet: http://t.co/zdQFyHxokO
555995991749709825,2015-01-16 07:52:28,"Politihogskolen",1. januar blei det innført krav til politiet si responstid. Her er krava: http://t.co/f6WhsJxY1J
556500215986151424,2015-01-17 17:16:05,"Politihogskolen",RT @PFStudentene: Vil du bli politi? Follo politidistrikt inviterer til informasjonskveld torsdag 22. januar kl 18.00... http://t.co/23XbKD…
557178999546597377,2015-01-19 14:13:20,"Politihogskolen",Endringar ved bacheloropptaket 2015: http://t.co/nTqyhOcQey.
557494047590604801,2015-01-20 11:05:13,"Politihogskolen",RT @Regjeringen: Kampanje mot vold i nære relasjoner http://t.co/aEbBJoeJn6
557540007725252609,2015-01-20 14:07:51,"Politihogskolen",4.-5. februar inviterer PHS til Utdanningskonferansen 2015. Temaet er politiutdanning i endring. http://t.co/eBC1DlelGT
557843292025798658,2015-01-21 10:12:59,"Politihogskolen","Våpentreninga ved PHS er nær dobla sidan -07, og kvaliteten er langt betre. Les ""Sjefsbloggen"" http://t.co/AaBHMvmnQs"
557896335933054977,2015-01-21 13:43:46,"Politihogskolen","""Den digitale timen"": Eirik Newth snakka om overvaking og personvern i eit framtidsperspektiv. http://t.co/4qy3im0ymj"
558562816467419137,2015-01-23 09:52:07,"Politihogskolen",Hugs å melde deg på Utdanningskonferansen 2015. Frist 26. jan. http://t.co/1c8LP6qAbW  #phsutdanning
559682063373459456,2015-01-26 11:59:36,"Politihogskolen",Politiet skal saman med andre etatar finne ein modell for best mogleg handtering av brudd på dyrevelferdslova. http://t.co/OXpTF0JtMS
559993016312954880,2015-01-27 08:35:13,"Politihogskolen","Ny dato for Forskningskonferansen. Temaet i år er ""Etterforsking"".  http://t.co/hfUdii3Zkj"
560337358273671168,2015-01-28 07:23:31,"Politihogskolen","Tysvær Bygdeblad fekk vere med då praksisstudentar øvde på konflikthandtering, sanitet og maktbruk.Foto:Mona Terjesen http://t.co/HGbgJkfZJG"
560354992792825856,2015-01-28 08:33:35,"Politihogskolen",Politiet ønskjer at fleire med ikkje-vestleg bakgrunn skal søkje Politihøgskolen. http://t.co/kpVsoxrC0O
560695950310903808,2015-01-29 07:08:26,"Politihogskolen","PHS med nye høyringssvar: Endring av våpeninstruksen-mellombels generell væpning,og endring av politilova og ekomlova.http://t.co/NHxTeYtAb4"
560715667796926464,2015-01-29 08:26:47,"Politihogskolen",PHS trappar opp jakta på dyktige jobbsøkjarar.  http://t.co/iruTxMz4zy
561115597267042305,2015-01-30 10:55:58,"Politihogskolen",PHS gratulerer @RuneGlomseth med å fylle krava til førsteamanuensis kompetanse i org og leiing. Les meir om han på http://t.co/erd7GsWZSw
562175372331327488,2015-02-02 09:07:08,"Politihogskolen",Ny master ved PHS: «Kva kan forklare veksten i bevæpningsordrer i politiet?» http://t.co/oTzSf90nZz
562210588206850049,2015-02-02 11:27:04,"Politihogskolen",Gledelege nyheiter for dei som ynskjer å bli politi. Dei nyutdanna er no raskare i jobb - og fleire i fast jobb http://t.co/NQteMEHkW0
562230446223007744,2015-02-02 12:45:58,"Politihogskolen","@MartinRebbell Vi ønsket ikke å eksponere reelle søkere. Vanlig casting,  ga info om dette i sak om kampanjen."
562335469837758465,2015-02-02 19:43:18,"Politihogskolen",Rundt 85 besøkende på infokveld i Bodø fikk prøve seg på ulike stasjoner som viste frem deler av politiutdanningen. http://t.co/zMhaIra6k8
562614641176895488,2015-02-03 14:12:37,"Politihogskolen",RT @Politiforum: Kun de beste er gode nok for livvakttjenestene i politiet. Og det handler om personligheten:  http://t.co/Q5EfDtL2lB
562929019164053504,2015-02-04 11:01:51,"Politihogskolen",PHS er klar for Utdanningskonferansen 2015 - Politiutdanning i endring. #phsutdanning http://t.co/FIxGF3wMNs
562929653837750272,2015-02-04 11:04:22,"Politihogskolen",Rektor Nina Skarpenes åpner konferansen med at Bachelor i politiutdanning har de mest fornøyde studentene #phsutdanning
562932345314213888,2015-02-04 11:15:04,"Politihogskolen","Håkon Skulstad, prosjektleder for Politireformen,  snakker om kunnskaps- og kompetanseutvikling i politiet. #phsutdanning"
562933515319533570,2015-02-04 11:19:43,"Politihogskolen","På vei mot fremtidens politi. - Vi må levere en like god tjeneste i morgen som i dag,  sier Skulstad. #phsutdanning http://t.co/x2hCaQ0ji0"
562940269755379713,2015-02-04 11:46:33,"Politihogskolen","Skillet mellom høgskole og universitet mer flytende , sier prof. Jens-Christian Smeby,  senter for Profesjonsstudier v HiOA. #phsutdanning"
562941293756940288,2015-02-04 11:50:38,"Politihogskolen",Smeby: Økt behov for å kunne arbeide og argumentere kunnskapsbasert #phsutdanning
562944255510208513,2015-02-04 12:02:24,"Politihogskolen",Smeby: Meningsfulle sammenhenger mellom teori og praksis er viktig for at studentene skal få et godt utbytte av studiet #phsutdanning
562944949197762561,2015-02-04 12:05:09,"Politihogskolen","Nyutdannede er ikke ferdig kvalifisert,  sier prof. Smeby #phsutdanning"
562956380651683841,2015-02-04 12:50:35,"Politihogskolen","Politimester R. Kilvær: Kvaliteten på politistudentene er høy,  både på nyutdannede og studenter i praksis. #phsutdanning"
562961686295228416,2015-02-04 13:11:39,"Politihogskolen","Ass.avd.dir i NOKUT,T Meza: PHS-studenter er veldig fornøyde med faglærers tilb.meldinger og veiledning.#studiebarometeret2014 #phsutdanning"
562963140414275585,2015-02-04 13:17:26,"Politihogskolen",RT @PHSbib: Nysgjerrig på bokgavene foredragsholderne får? Du finner dem i biblioteket! #phsutdanning #teoriogpraksis http://t.co/rF9nTbtZG1
562964096409411586,2015-02-04 13:21:14,"Politihogskolen","Politistudentar mest fornøgd med utdanninga, ifølgje Studiebarometeret http://t.co/uBNDplrSS3"
562967890467758081,2015-02-04 13:36:19,"Politihogskolen","""Hold underviserne ""oppdateret"" på praksis"" - P.A. Hansen fra Politiskolen DK. #phsutdanning"
562969344624574465,2015-02-04 13:42:05,"Politihogskolen","Politioverbetjent M. Skjæret: ""Er det manglende sammenheng mellom undervisningen på PHS og det som skjer ute i etaten?"" #phsutdanning"
562972706598297603,2015-02-04 13:55:27,"Politihogskolen","M.Skjæret: ""Det er viktig å legge til rette for at studenter kan hente kunnskap på en god måte i praksisåret"" #phsutdanning"
562974281530081281,2015-02-04 14:01:42,"Politihogskolen","PHS-høgskolelektor Kjersti Eckblad: ""Veiledning er en bærebjelke i andre studieår"". #phsutdanning"
562981937539973120,2015-02-04 14:32:08,"Politihogskolen",Vi gjør oss klare til debatt om praksisstudiet. #phsutdanning http://t.co/zO2lKNQoZr
563316865330851840,2015-02-05 12:43:01,"Politihogskolen",Politistudentar mest nøgde med utdanninga. Meir om undersøkinga og konferansen om utdanning på http://t.co/XCeRuZ096J.
563670784305266688,2015-02-06 12:09:22,"Politihogskolen",Vi ønskjer god helg med dette vakre bilete frå avd. Kongsvinger :) http://t.co/3Toe1QmXze
565071416358621184,2015-02-10 08:54:58,"Politihogskolen",To nye høyringssvar frå PHS - om ulike tenester i politiet. http://t.co/NHxTeXCMMS
565481570333896704,2015-02-11 12:04:47,"Politihogskolen","Høyringssvar om forebygging, KRÅD og nasjonalt senter for kunnskap og formidling i justissektoren. http://t.co/NHxTeXCMMS"
565843336565907456,2015-02-12 12:02:18,"Politihogskolen",50 tok turen til Stavern for å høre om politiutdanningen. De oppmøtte fikk høre hva studentene syntes om utdanningen. http://t.co/4O7e1Fjant
566204520309743616,2015-02-13 11:57:31,"Politihogskolen",Prosjekt ved PHS får millionstønad over ein femårsperiode: http://t.co/yopFWFVrza
567294626777022465,2015-02-16 12:09:13,"Politihogskolen",Sjefsbloggen: Fornøgde studentar og nye mål. http://t.co/UGD1clq7xH
567684524004626432,2015-02-17 13:58:32,"Politihogskolen",Nødetatane tek i bruk felles prosedyre ved pågåande livstruande vald. PHS står for opplæringa. http://t.co/dkK0xrkmN3
567993558860500992,2015-02-18 10:26:31,"Politihogskolen",Positive signal om PHS i ny politistruktur http://t.co/k6W6Qhf3YX
568030103067869184,2015-02-18 12:51:44,"Politihogskolen",Kven blir terroristar? Kronikk av PHS-professor Tore Bjørgo @NRKYtring. http://t.co/lMW9SO33Fs
568352075920347136,2015-02-19 10:11:09,"Politihogskolen",Sjå video om pilotprosjektet «Politiarbeid på stedet»: http://t.co/r8kpqDhtax.
568708171369451520,2015-02-20 09:46:08,"Politihogskolen",Leiar for PF-studentane Skibstad om jobbfokuset: meiner nyutdanna politistudentar må stille krav til seg sjølv. http://t.co/62HHKoO632
568735212340961281,2015-02-20 11:33:35,"Politihogskolen",Diagnose: Vi treng eit mangfaldig politi. #twitterlegen @WasimZahid er ambassadør for politiutdanning. http://t.co/NQSIyVimjK
569776866191650816,2015-02-23 08:32:45,"Politihogskolen","Tigging, tull og taushet. Kronikk av PHS-professor Tor-Geir Myhrer @NRKYtring. http://t.co/6sjUm0125g"
569842974085025792,2015-02-23 12:55:26,"Politihogskolen","Kva betyr leiing i politiet? Statsråd @AndersAnundsen gjestar PHS si utdanning ""Leiing og organisasjonsutvikling 2"" http://t.co/nl6Pq9kCJR"
569881114527059968,2015-02-23 15:27:00,"Politihogskolen",Boklansering: @ToreBjorgo legg fram den nye boka si «Forebygging av kriminalitet» på PHS måndag 9. mars. Meld deg på: http://t.co/6KvCgRfkY6
570527287797551104,2015-02-25 10:14:39,"Politihogskolen",I fyrste episode av «Lov og orden» @TVNorge i morgon møter sjåarane mellom anna politistudentar og rettleiarane deira http://t.co/PTsQxxI9HG
570909553157640192,2015-02-26 11:33:39,"Politihogskolen","Politioverbetjent @Tanrangar, frå PHS,  med kronikk i Politiforum. «Hvilke verdier dominerer på ordensavdelingen?» http://t.co/RwsKHWukMV"
571207244441894912,2015-02-27 07:16:34,"Politihogskolen","«Nordisk politiforskning», eigd av PHS, er godkjent som nivå 1-tidsskrift i Norsk samfunnsvitenskapelig datatjeneste.http://t.co/JSbZIBxsmS"
571313695109869568,2015-02-27 14:19:34,"Politihogskolen",Professor og forfattar @ToreBjorgo ynskjer velkomen til boklansering av «Forebygging av kriminalitet» på PHS 9. mars. http://t.co/Wuf5IgwEtl
572338259805786113,2015-03-02 10:10:49,"Politihogskolen",RT @PFStudentene: Jørgen Ahlquist i politiet ville vise hvor godt og tett de forskjellige utrykningsetatene og... http://t.co/zLkm2UqTvQ
572699501745602560,2015-03-03 10:06:16,"Politihogskolen",Innan august skal PHS lære opp 12 000 polititilsette i ny straffelov. http://t.co/LOTU8B3Y5b
573030688712204288,2015-03-04 08:02:17,"Politihogskolen","Meld deg på: http://t.co/6KvCgRfkY6 @ToreBjorgo si boklansering av ""Forebygging av kriminalitet"" 9.mars. http://t.co/I06XstdnPW"
573123388430024705,2015-03-04 14:10:38,"Politihogskolen",Under Arbeidslivsdagen fekk politistudentane sjå og høyre om kva moglegheiter som finst etter studie. http://t.co/HBeXuX3NuV
573386779493072898,2015-03-05 07:37:15,"Politihogskolen","PHS har gjennomførd ein pilot, og set til hausten i gong eigen studie for operatørar, med studiestad i Stavern. http://t.co/iGcwoMukx4"
573450927060996096,2015-03-05 11:52:09,"Politihogskolen",Korleis blir leiarar rekrutterte i politiet? Politioverbetjent @ChrisCrlsn frå PHS med kronikk i @Politiforum. http://t.co/DwdqYXfvGy
573470085844721664,2015-03-05 13:08:17,"Politihogskolen",Masterstudiet i politivitskap endra. Fleire emne og masteroppg halvert til 30 stp. Søk opptak 2015 i dag. http://t.co/nkJkd213l4
573820668715909120,2015-03-06 12:21:23,"Politihogskolen",Regjeringa la i dag fram proposisjonen om den varsla politireforma.   http://t.co/3chgc3IuDu
574858092329988096,2015-03-09 09:03:44,"Politihogskolen",Tidenes høgaste søkjartal til PHS. Politistudentar ønskjer søkjarane lukke til med opptaket. http://t.co/6HZgTYyPOW http://t.co/0JmNZk2rXe
575229151419985920,2015-03-10 09:38:11,"Politihogskolen",Ny bok frå professor Tore Bjørgo - presenterer modell som kan førebyggje alle typar for kriminalitet http://t.co/0KqadPtMYa
575293236576698369,2015-03-10 13:52:50,"Politihogskolen","Ny, felles utdanning for kontrolletatane og politiet innen arbeid mot økonomisk kriminalitet http://t.co/tZGZykvQMy"
576327850246172672,2015-03-13 10:24:01,"Politihogskolen","Talet på utdanningar innan etterforsking dobla, og talet på studentar meir enn dobla på fire år http://t.co/uy0sNaNi46"
576346327866609664,2015-03-13 11:37:27,"Politihogskolen",PHS har gitt høyringssvar om den såkalla «cold-case&gt;»-gruppa http://t.co/NHxTeXCMMS
578542156018794496,2015-03-19 13:02:53,"Politihogskolen",Kompetanselyft i rettleiing - praksisrettleiarar har gjennomført kurs. http://t.co/YHvNMTEtZz
579945893517987840,2015-03-23 10:00:50,"Politihogskolen","PHS har gjeve høyringssvar om skuld, sakkunne og vern av samfunnet. http://t.co/NHxTeXCMMS"
580662654475329536,2015-03-25 09:28:59,"Politihogskolen",Vi gratulerer Sverre Flaatten med vel gjennomførd disputas med avhandlinga «Høyesteretts lenker». http://t.co/37YsUpM1SU
581071454822916096,2015-03-26 12:33:25,"Politihogskolen","PHS-søkjartala fordelte på distrikt er klare, Haugaland og Sunnhordland pd toppar statistikken med ein solid auke. http://t.co/sVxSBNBx2p"
586429991669252096,2015-04-10 07:26:20,"Politihogskolen",Pol.stud Maja hadde rollen som innsatsleder da et tog kolliderte med en buss. Hun mener reelle øvelser er uvurdelig. http://t.co/mLuhKw1e4i
587906544123125760,2015-04-14 09:13:37,"Politihogskolen",N. Skarpenes drøymde om å bli leirskulelærar i havgapet - no er ho rektor for dei mest fornøgde studentane i landet. http://t.co/WkUQ73AGZX
588316553797627905,2015-04-15 12:22:51,"Politihogskolen",Ikke bare har vi de mest fornøyde studentene i landet- vi har fornøyde ansatte også. Ny medarbeiderundersøkelse: http://t.co/XJXB4z3M49
588969660659458048,2015-04-17 07:38:04,"Politihogskolen","Slik kan ein førebyggje både fyllekøyring, innbrot og terrorisme, sjå videorep med @ToreBjorgo Bjørgo @forskningno. http://t.co/MYlv7iWOTH"
588990709228769280,2015-04-17 09:01:42,"Politihogskolen",No skal enda fleire av utdanningane våre jobbe tett med etaten for å sikre relevans og ny kunnskap. http://t.co/7nFdXlinaA
590084691484610560,2015-04-20 09:28:48,"Politihogskolen",Nina Skarpenes lanserer lisens for etterforskarar i nytt innlegg på Sjefsbloggen. http://t.co/6DvKIpzpKv
591533245356990464,2015-04-24 09:24:50,"Politihogskolen",@Politiforum Tusen takk! Her jobbes det for fullt med opptaksprøver.
